author,body,id,link_id,permalink,score,subreddit,is_submitter,total_awards_received,date
branperkins1213,"&gt; I said ""The Last Jedi"" trailer is misdirection

And that's your problem! That's what I've been arguing. They aren't going to release and entire trailer that puts a false idea of the story in your mind. That's not the point of trailers! One point of trailers is to get you to see the movie, like you said, but it's also to tell you what to expect when you watch said movie. They don't show you what the movie is going to be about in a trailer only for them to show you something completely different in the movie. That defeats the whole purpose. 

My point is that if you watch the TFA trailer, what you saw there was what you got in the movie. This is no different. ",do8dc0l,t3_75qyo3,,13,starwarsspeculation,,,2017-10-11
McIgglyTuffMuffin,Kesha would be a porg from Star Wars: The Last Jedi because she's adorable as hell and can also be fiesty as hell.,do81g4z,t3_75pra7,,13,popheads,,,2017-10-11
Raktoner,"Yesterday I got my ticket to see Star Wars on Thursday the 14th at 10:15pm (Eastern). Today I realized that means I'm missing the Broncos Thursday night game in Indianapolis.

Normally it's Broncos before almost anything, but I'm not risking The Last Jedi being spoiled for me like The Force Awakens was. ",do83owi,t3_75q0oc,,13,nfl,,,2017-10-11
Quenadian,"Balance is achieved with the end of dogmatism.

Both Jedi and Sith were dogmatic institutions that needed to end for balance to be achieved. They both had institutional rules that were inhumane. On the Jedi side best exemplified by their complete mismanagement of Anakin's struggle.

Luke rejects the jedi dogma that he must let his friends suffer, commit patricide, that there is no return from the dark side.

Luke is a balanced force user, operating from inner humane motivations instead of rigid external dogmatic rules.

Vader/Anakin brings balance by killing the Emperor and himself, thus removing the last remaining dogmatric force users and ending the Sith institution.

What would make the most sense for the Sequel trilogy is that Luke was oblivious to his transcendance of Jedi dogma and reverted to their ancient dictate for his new Jedi order and unsurprisingly completely fucked it up with Ben Solo, Throwing the force out of balance once more....

Luke is right in the trailer, the Jedi must end...


",do7z9uj,t3_75og4l,,10,FanTheories,,,2017-10-11
scruffycoxendale,Thanks! I'm using this one on mobile: https://www.moviemania.io/wallpaper/pm3wa85175-star-wars-the-last-jedi,do8ks15,t3_75r9td,,10,StarWars,,,2017-10-11
MonsieurCandie,Star The Last Jedi Wars,do8ic7v,t3_75pkls,,10,PrequelMemes,,,2017-10-11
BryceGladwin1,The Last Jedi Awakens The Force. ,do84ykt,t3_75ohcg,,9,PrequelMemes,,,2017-10-11
sciencesold,"But look at reys outfit, it's from when she arrives on Ahch-To at the end of the last movie and we know she changes into her training garb and hair style then (maybe) back to what she wore for a majority of TFA. We don't see her in the that outfit again in the trailer. 

I'd also like to point out in all the trailer for TFA we didn't know Rey was the Jedi, they only ever showed Finn with the lightsaber. It's kinda the goal of a trailer, misdirect everyone so they're more suprised. 

It's also not Disney's decision on how trailers are cut, it's the director and then LucasArts approves it. The director (I think) tweeted out not to watch the trailer because he thought it was a cut where it appears Rey kills Luke. It's all about editing. ",do7ppd1,t3_75kaw7,,9,DaisyRidley,,,2017-10-11
Mark316,I'm betting a lot of The Last Jedi won't make sense unless you've seen the Ewoks movies. You'll probably want to see those before December.,do71ql5,t3_75j64q,,9,StarWars,,,2017-10-11
brokendowndryer,"Who is excited for Star Wars The Last Jedi?

The trailer Monday night was awesome. I can't wait until December!",do80to4,t3_75poks,,8,NASCAR,,,2017-10-11
maveric710,"""He was our last hope.""
""No. There is another.""

Luke is the last Jedi when Leia is killed. And when she is killed, Luke goes on a revenge spree (killing Snoke and taking over the First Order). Think about it, Leia was the only person that Vader successfully used to get under Luke's skin (and rage out on him). Leia dies, Luke loses it (Anakin shows up in ghost form to dissuade Luke).  The Last Jedi now turns to the Dark Side, leaving the Jedi completely extinct (no one is a full fledged Jedi due to lack of training/affiliation). Rey leaves Luke after his switch, prompting Kylo (through a redemption arc since they killed mommy) and Rey to team up.

Kylo (who is 9/10th Jedi) trains Rey, who is extremely powerful, to take on Emperor Skywalker in Act IX. Luke and Kylo die at the end of XI, ending the Skywalker Saga. Rey gets thrown down an exhaust port for good measure.",do76798,t3_75hzw0,,8,StarWars,,,2017-10-11
turkeypedal,"I'm pretty sure you guys just missed a joke. But here's an excerpt from [the article](https://www.vanityfair.com/hollywood/2017/05/star-wars-the-last-jedi-title?mbid=social_twitter):

&gt; Vanity Fair: So, do we know what the words The Last Jedi allude to?

&gt; Kathleen Kennedy: Why in the world do you think I would tell you that?

&gt;I’ll tell you why. Back in 1998, I interviewed George Lucas for V.F. ahead of The Phantom Menace, and I asked, “Who or what is the phantom menace?” And he nonchalantly said, “Oh, it’s Darth Sidious.”

It's a joke about what Lucas did. Both of the people in the article did in fact refuse to say who the Last Jedi is/are. 

The title is not clickbait, but 100% accurate. ",do7m1xc,t3_75i69u,,7,therewasanattempt,,,2017-10-11
BreakingBadEndind,"&gt; The force awakens the last jedi. 

The force awakens the last jedi from a nap.",do85c7g,t3_75ohcg,,7,PrequelMemes,,,2017-10-11
collinnator5,"Seeing ""Revenge of the Jedi"" still makes me feel uncomfortable. I also loved that last one. Those were good thanks",do8d014,t3_75qaph,,7,StarWars,,,2017-10-11
stan13ag,"Hey Mitch, Thanks for taking questions.  The trailer for Star Wars: The Last Jedi came out Monday, and at the end we see Kylo Ren extending his hand to Rey.  Do you think they are going to join forces to do good, or evil?",do7sfc2,t3_75okcg,,7,crossfit,,,2017-10-11
ludwigritcher752,"Actually I think Crait is in the third act but there are something more after the battle that the marketing is not telling us. I think the final battle will be on Supremacy with the Praetorian Guards. And I think will be Rey and Kylo vs Praetorian Guards, I don't know about Luke. Maybe will be the 3 against the guards, each one with a different lightsaber (Rey with blue, Luke with green, Kylo with red) and all the 3 are the last jedi. I'm from Brazil and here the translation of the title is plural. The first poster is with the 3 main characters. They are the last jedi.",do7vl8r,t3_75p0zq,,7,starwarsspeculation,,,2017-10-11
muckrucker,"My thoughts on Luke's storyline.

Jedi Temple:

* Luke starts training Force users and quickly realizes he's not strong enough to mentor that many at the same time but he soldiers on and does his best
* A couple of ""misfit Jedi"" emerge with much stronger than average power but with way weaker than expected control lead by the future Darth Temper Tantrum
* He has a showdown with Darth Temper Tantrum (and the rest of Team Rocket/Slytherin) that ends with the Temple being disbanded/destroyed/etc
* Luke's wife is killed in the ensuing battle/destruction
* He only spares Darth Temper Tantrum's life because of his parents and ships him back like a trouble maker from summer camp

Going into Exile:

* Recognizing that there's still a Sith force somewhere in the universe, Luke one-ups Obi-wan in his disappearance skills
* Luke leaves Rey (his daughter, imo) on a desert planet to largely fend for herself and to hide her from the remnants of the Empire, the mysterious Sith force out there, and himself
* Luke goes to the most remote place he can find to commune with the Force as a Jedi Monk - preparing himself for the day another Force user finds him again

Training Rey:

* Rey's power is completely on-par (or greater) with Anakin's (pre-higher ground moment)
* Luke attempts to train her to fully understand the balance to the Force, the give-and-take it requires, the service-for-everyone attitude that goes with it; Rey's only focus is stopping Darth Temper Tantrum and whomever she perceives as ""the baddies""
* They have an all-out ""sparring session"" that ends with Luke at the end of her/his light saber confessing she's his daughter and he was only trying to save her from the Force itself
* She huffs off, hurt and confused about everything in life (aka a teenager), until seeking out and eventually joining forces with Darth Temper Tantrum

My thoughts on Darth Temper Tantrum.

Space Combat:

* He gets past the defenses and blows his mother up on the command deck of her ship
* She ""Jedi-haunts"" him right at the end - either as the Jedi spirit/blue ghost or with some simple telepathy - and flips the switch making him realize the evil that's consuming/consumed him so far
* He flies away as the full gravity of her words hit him and realizes he murdered both of his parents in cold blood
* He vows to change and use his anger for good

Deep Reflection:

* Self-inflicted isolation in a not so hidden a corner of the galaxy ensues
* Rey manages to track him down
* He, realizing that Snoke was the dark force acting on him all along, informs Rey of Snoke's existence
* Rey, realizing that Luke was the light force acting on her all along, recounts the ""Weekend at Dad's House"" moments and informs him of Luke's existence
* They team up to go bring down the last Sith Lord and attempt to bring balance to the force

My thoughts on Snoke:

* He's Palpatine after taking a face full of Force Lightning, a nasty fall down an endless air duct/shaft, and surviving the Death Star explosion

* My thoughts are based on the Rule of Two and Vader and The Emperor both appearing to die in Episode VI; we know Vader is dead-dead as he shows up in Jedi ghost form but The Emperor could very easily just get the soap-opera treatment as we never saw the body.

* He physically stays close to everyone (to search/manipulate their feelings) but uses the hologram as a form of protection - his last apprentice, afterall, did ""kill him"" and leave him for dead

* The physical distance is necessary as he's become very frail in physical strength but exceptionally powerful in mental strength - not unlike Yoda towards his end.",do82u47,t3_75mjiw,,7,FanTheories,,,2017-10-11
Ancient_Demise,The Force Awakens. The Last Jedi. Jar Jar Binks.,do878dc,t3_75ohcg,,7,PrequelMemes,,,2017-10-11
tomanonimos,"&gt;a Resistance maintenance worker named Rose in Star Wars: The Last Jedi.

I wonder how big of a role she will actually have. 

Seriously though, I only saw characters from the previous films (and main characters to boot). ",do7fofm,t3_75luao,,7,asianamerican,,,2017-10-11
Yagami19,Because Jedi is an order of force users. Just because somebody can use the force doesn't make them a Jedi (nor Sith) so Luke is the last one of the Jedi order.,do8jfcb,t3_75gsb8,,7,StarWarsLeaks,,,2017-10-11
AGuyFromRio,"I get. But it would be an unexpected thing. It could be done, written by more apt people than myself, plus would raise a lot of questions as in ""how far would one go to prevent turning to the dark side?"".

I think Luke deserves a ""grandeur"" type of scene where he unleashes all his Jedi powers. 

The killing himself part is a bit too much, but I would call it a nice end to the last great link to the old franchise, enabling them to go wherever they want to go in the future without having to worry about the fate of old characters. 

And I'm daydreaming again 😂",do8er3h,t3_75dxvp,,6,StarWars,,,2017-10-11
olafur98,I'm so happy Rogue One turned out to be a treasure trove full of awesome looking characters. I remember seeing one of Saw Gerrera's men who wore black painted scout trooper helmet. I hope we see more in The Last Jedi!,do8iijr,t3_75rzrr,,6,StarWars,,,2017-10-11
LaLaurie87,"No shit. The title crawl, Snoke, and even Yoda says he is the last jedi

What is interesting is the Vanity Fair article where Rian says the international translations of the title are pure fuckups.

",do8aa0a,t3_75r7yq,,5,starwarsspeculation,,,2017-10-11
Speshul_J,The Last Jedi ~~Poster~~ Screen Cap Montage with Quotes Done in a Crappy Font,do8gelc,t3_75ruqi,,5,StarWars,,,2017-10-11
0borowatabinost,"Lucasfilm is owned Disney, and I'm sure the Disney execs get final say in what goes into these movies.  They payed four billion dollars for Lucasfilm, they're gonna make the movies as safe and profitable as possible.

The new *Last Jedi* trailer had to have been intentional misdirection.  There's no way they would blatantly spoil their own movie like that.",do8onsv,t3_75qnw1,,5,movies,,,2017-10-11
hermiona52,"Widziałam w sobotę. Byłam i byłabym dalej zachwycona, gdyby nie trailer The Last Jedi (już tak chyba zostanie do grudnia). W tym momencie Villeneuve(?) jest reżyserem, którego filmy będę oglądać w ciemno - nie ma filmu, który nie byłby świetny.
Nowy Blade Runner jest dla mnie jednym z najlepszych sci-fi w historii. Nie zauważyłam kiedy te prawie 3h minęły. Wizualnie to po prostu sztuka najwyższej klasy. Jeśli kiedykolwiek widziałam film 10/10 to właśnie on zasługuje na taką ocenę.",do7tb2t,t3_75om3b,,5,Polska,,,2017-10-11
Angsty_Kylo_Ren,"Yoda, Darth Maul, Luke, Vader, Leia, Palpatine, Han, Boba, Chewbacca, Bossk, Lando, Iden Versio, Rey and Kylo Ren.

Finn and Captain Phasman are coming out with the Last Jedi.",do84pgn,t3_75p5bv,,5,StarWarsBattlefront,,,2017-10-11
Used_Taco,I thought it was funny when everyone was arguing about who the last jedi is.. ,do77jx4,t3_75lxok,,5,StarWars,,,2017-10-11
ToxicAdamm,"I don't think it showed any more/less than the trailer for Force Awakens showed. 

Maybe you should think about going into a 'blackout"" on The Last Jedi media before the movie releases. It will be hard, but you'll be able to do it.

",do7re5c,t3_75oqxs,,5,movies,,,2017-10-11
alanmarquesleal,"Fargo S1. I'm in half of the season and this TV show is as good as they say. I had seen the third season and the character development, cinematography of the show, and the acting was something that rivalled True Detective  S1 for me. Said that, the first season has a feeling different of S3, not better I would say, more action-driven, while S3 was more character-driven.
The Clone Wars: heard about it in r/Starwars and how it expanded Star Wars universe and decided starting watching. So much fun and humanity to those characters. It's amazing. Intend to finish near to The Last Jedi release in December. ",do7z1g9,t3_75potc,,5,television,,,2017-10-11
FlamingForFame,"From the Interview with Kevin Jenkins

&gt; The front legs are very heavily armored, and you can see almost up to the forearm. And again, that’s my take on, “You can’t take these down with a snowspeeder.” They’ve armored up the front or maybe they just cut the ropes because they are too big now. 

Source: http://www.starwars.com/news/inside-two-deadly-new-first-order-vehicles-from-the-last-jedi

",do71wtu,t3_75l9lt,,4,StarWars,,,2017-10-11
predaguy,"It's just a flatter Tie-Interceptor. I still like it but I prefer the Interceptor more. I'm definitely gonna get this one too, though, my local shops still haven't gotten The Last Jedi merch at all.",do7531h,t3_75jpry,,4,ActionFigures,,,2017-10-11
secondcityrocker,"Some Legends books that stick out in my memory (and not in a good way):

Courtship of Princess Leia- The New Republic tries to put Leia in an arranged marriage with the prince of some planet so Han Solo kidnaps her. Luke and the Prince go find them, then everyone teams up to fight Imperial Admiral who went out on his own #652. They defeat him, then everyone realizes the arranged marriage thing was a mistake and Leia marries Han instead. It's as cheesy as you'd expect.

Children of the Jedi-Luke gets trapped aboard one of the many lost Imperial super weapons that the Emperor apparently just had lying around. He teams up with the spirit of a Jedi that is possessing the weapon to stop it. Luke ends up falling in love with her, and she takes over the body of one of his students that got killed off earlier. It always weirded me out how Luke didn't seem too bothered by that last part.

Truce at Bakura: On the day after the Battle of Endor, the gang goes to some random Imperial-controlled planet to help the local Imperial forces fight off a race of lizard aliens from outside of the galaxy. The Imperials teaming up with Rebels to fight off a greater threat idea had potential, but the lizards power their technology with batteries that were made by draining the life force (not THE force though) of their prisoners, which makes it extra cheesy.

The New Jedi Order: I only read a couple of these since I couldn't get into these because the Vong are like something a 12 year old would come up with: aliens from outside of the galaxy who are immune to the force, destroy planets like it's nothing, worship pain, and look like rejected GWAR characters.

The Dark Nest Trilogy: Basically the New Jedi Order, but with a race of bugs that used to live on Alederaan before humans did.",do7esaj,t3_75mb4g,,4,StarWars,,,2017-10-11
underhunter,"""The Last Jedi"" might be like ""The Last Roman"" title that sooo many people held in history. ",do7o0ok,t3_75mxxn,,4,StarWars,,,2017-10-11
LaLaurie87,"I'm sorry but no one can deny these things aren't cool

https://fsmedia.imgix.net/0f/cf/74/19/5624/417c/bbdf/9fb18dbf4210/star-wars-the-last-jedi-2017.gif

",do8iifw,t3_75s5ye,,4,movies,,,2017-10-11
JakkuScavenger,"Rian shot some scenes on the island for The Last Jedi way back in September 2015, before TFA was even released. Then, I think they shot some in the spring of 2016 for a few days and the rest was shot in Ireland. ",do7hd4h,t3_75j6x2,,4,StarWarsLeaks,,,2017-10-11
LittleDannyB,[Vogue article](https://www.vogue.com/article/daisy-ridley-the-last-jedi-star-wars-november-vogue-cover-2017?mbid=social_twitter),do7qlad,t3_75osls,,4,DaisyRidley,,,2017-10-11
JediPaxis,"No, but you can find a 1080p with lossless audio [here](https://thedigitaltheater.com/index.php/star-wars-episode-viii-the-last-jedi-2017/). ",do7tyv5,t3_75p6hh,,4,StarWars,,,2017-10-11
IronKnuckles64,Gonna go to the midnight release. They are showing Force Awakens before The Last Jedi which is great. ,do83gs1,t3_75cwai,,4,StarWars,,,2017-10-11
MichaelM_Yaa,I think Luke meets Rey for the 1st time in the Last Jedi.,do7gmcr,t3_75mn8t,,3,starwarsspeculation,,,2017-10-11
dani4117,"The director said luke is one of the last jedi. Given the fact in all otjer languages its plural  and since no one has seen the film maybe just maybe his messing / not saying the whole truth like mark hamill always does?

Of course a massive marketing failure by one of the biggest companies in the world is most likely. Sure thing.",do7xnrw,t3_75gsb8,,3,StarWarsLeaks,,,2017-10-11
Towowl,"The force awakens the last jedi, and he's not happy ",do86udn,t3_75ohcg,,3,PrequelMemes,,,2017-10-11
ethanandstuff,"So you know how tickets for Star Wars The Last Jedi went on sale? I work at a movie theater and for the past week we've had this one guy either come in or call us screaming about when are they going on sale. Every single time we told him to calm down and there was nothing we could do until Disney announces it. He was there on Monday when presales went live however he didn't know what time we could sell them. By the time he got there all of the first night was sold out and he just sits on the floor and starts screaming and kicking his feet. This was a forty year old man who wore business casual clothes, blutooth ear piece, and all the other like suburb dad cliches. Crying on the floor over Star Wars tickets.",do7inf8,t3_75koqp,,3,AskReddit,,,2017-10-11
HuxBonteri,"According to the Lucasfilm Story Group, you can't just ""use the light and the dark"" without falling to the dark. They also said there's no such thing as a grey Jedi. And these people worked on The Last Jedi.",do7v4mc,t3_75kaw7,,3,DaisyRidley,,,2017-10-11
Emtenica,"Science Museum IMAX.

On top of the ones mentioned here already.

It has a massive IMAX screen and it can be cheaper than BFI plus you will be supporting the Science Museum which is awesome.

Only problem is the limited selection of films although Dunkirk was shown there and Star Wars: The Last Jedi will be showing there . ",do7w08m,t3_75knu0,,3,london,,,2017-10-11
tc_spears,"The Force Awakens.
The Last Jedi.
's Irritable Bowel Syndrome.",do83t7b,t3_75ohcg,,3,PrequelMemes,,,2017-10-11
sepharih,"http://www.slashfilm.com/mark-hamill-rian-johnson-disagreement/

and a followup

http://comicbook.com/starwars/2017/06/12/mark-hamill-on-disagreement-with-last-jedi-director-rian-johnson/


It could be complete PR, but I'm willing to believe Hamill was honest when he says he came around to the directors way of thinking.  Even still, the point remains that they've taken Luke in a direction that may wind up be very polarizing to a lot of people.",do8d4rq,t3_75m36m,,3,StarWars,,,2017-10-11
cidraman,"Well, if you look closely, he's using the Force in the last poster. Maybe he's the Last Jedi. That's why he's not in the trailer.",do8o3hx,t3_75sufv,,3,StarWars,,,2017-10-11
mushroomguy12,For some reason these trailers and promotional materials have also been not showing that other green lightsaber I was last seen on the big screen with. I hope it’s just a clever marketing ploy and not that they were actually lame enough write it out of the plot the same way they wrote out the New Jedi Order and New Republic.,do801db,t3_75jjp2,,3,SequelMemes,,,2017-10-11
Reavor,"[Old faithful, Iron Rangers today](https://i.imgur.com/rqRs5R7.jpg)

Aotd: Thor, The last Jedi, and blade runner as far as movies go. Trying to achieve a near spoiler free viewing of the next star wars by avoiding the newest trailer for it. And I hear blade runner is one of the best movies of this year so that should be pretty good. ",do80djq,t3_75pk3c,,3,goodyearwelt,,,2017-10-11
AroundGoesThe18,The force awakens the last Jedi from a nap.,do89otw,t3_75ohcg,,3,PrequelMemes,,,2017-10-11
NormalNormalNormal,I wonder if TR8R will come back in The Last Jedi.,do7570v,t3_75e122,,3,RedLetterMedia,,,2017-10-11
ShittyThrowAway0091,"In fact, I'm sure Carrie Fisher is getting a CG recreation of her older self in The Last Jedi.",do7jliw,t3_75j2lt,,3,quityourbullshit,,,2017-10-11
alanmarquesleal,"I seriously don't know. By what I heard, I think the revelation on whether only Kylo or only Rey or both will be one of the last Jedi will be presented as shockingly as Vader being Luke's father. It might even be Finn. I didn't get his character at all in TFA. I can't barely wait! ",do7t24e,t3_75ma1s,,3,StarWars,,,2017-10-11
starwarsfan48,"1: The Last Command
2: Survivor's Quest
3-6:
* Heir to the Empire
* Dark Force Rising
* Outbound Flight
* Vision of the Future
7: Iron Fist
8: I, Jedi
––––––––––––––––––––––––––––––––––––––––
9-13:
* Solo Command
* Allegiance
* Choices of One
* Scoundrels
* Specter of the Past
14-22:
* Lando Calrissian Adventures trilogy
* Han Solo trilogy
* The Krytos Trap
* Wraith Squadron
* Shatterpoint
––––––––––––––––––––––––––––––––––––––––
23-32:
* Rogue Squadron
* Wedge's Gamble
* The Bacta War
* Isard's Revenge
* Han Solo Adventures trilogy
* Jedi Academy trilogy
33-36:
* Tales from the Mos Eisley Cantina
* The Courtship of Princess Leia
* Vector Prime
* Star Wars Episode IV: A New Hope
––––––––––––––––––––––––––––––––––––––––
37: Dawn of the Jedi: Into the Void
38-54:
* Dark Forces trilogy
* Target 
* Jedi Apprentice 1, 4-14
––––––––––––––––––––––––––––––––––––––––
55: The Hidden Past
56: The Dark Rival",do7ylhw,t3_75l3vz,,3,StarWarsEU,,,2017-10-11
KJatWork,"Jedi is a singular and plural form. There is no reason to believe it only means one.

One can very easily say that Luke and Rey are ""The Last Jedi"", for example.

Also, Disney isn't going to be too interested in seeing their ""princess"" go dark and risk a loss of Disney Princess fans and Kylo had the gold attitude thing down very well. ",do80wx4,t3_75q1ye,,3,StarWars,,,2017-10-11
Kiggsworthy,"Oh, I like it!

""The Force awakens the last Jedi Knights of the Republic"" totally works!",do86hz5,t3_75qmf5,,3,StarWars,,,2017-10-11
donkeyrocket,"I think it is a pretty interesting, fairly refreshing take on the typical Star Wars poster. Looking at the film, marketing, etc. they've really gone for the red motif and it is working. This far an away has the most stark contrast in color of any Star Wars poster.

My only complaint is the font choice for ""DECEMBER 15"" is too bloated. I get that it is the same font as ""THE LAST JEDI"" but that part is utilitarian so a more simple san-serif would feel better (I just dislike the M, B and R). This is incredibly nit-picky because I think the rest of the poster is great. 

Poe being on the right side, aligned totally with the bad guys has led to speculation of foreshadowing but I'm holding fast in my opinion that they simply had to juggle celebrity hierarchy. Who knows though.",do79n63,t3_75dfxc,,2,graphic_design,,,2017-10-11
Airaku,"Seriously? I knew nothing about his voice over in these trailers nor noticed it. Where was it in the last teaser? Was it with Rey?


In TFA you can hear Palpatine's voice saying ""Any Jedi"" in the Force flashback scene.",do7invm,t3_75nbxn,,2,starwarsspeculation,,,2017-10-11
