author,body,id,link_id,permalink,score,subreddit,is_submitter,total_awards_received,date
tommmytom,"[So I did something similar here, and I'm going to do it again. It's important to consider all point of views and I think parts of this can be refuted. And this is coming from someone who has, in the past, on and off supported the Snoke=Darth Plagueis theory.](https://www.reddit.com/r/starwarsspeculation/comments/75sh84/still_feelin_plagueis_theory_especially_after_the/do8z77n/?context=3)

&gt; NOTE ON THE INSIGNIFICANCE OF THE EU

There are other ways to tie the three films together than Snoke being Darth Plagueis because of a small mention in Revenge of the Sith. Whether these ways are just as good as the possibility of Snoke being Darth Plagueis is debatable, of course, but there are certainly other ways.

&gt; MUSIC

I still think this can be refuted as generic dark side guy music, but that's just me. I get that it's the same motif and all though. It's certainly evidence though.

&gt; SNOKE REGENERATED

He may very well be ""regenerating,"" but this doesn't necessarily mean that Darth Plagueis is the only Force user who is capable of that, even if he's the only one whose been explicitly mentioned of midichlorian manipulation in the past. Snoke could still be a character on his own capable of such power as well, especially depending on who he exactly is. But this is certainly evidence to the theory as well.

&gt; WHEN I FOUND YOU

Interesting thought. I mean, maybe. Not much to work off of here, really, which is alright of course. Either you are right or wrong, and that's just something we will have to wait and see.

&gt; AWKWARD PANEL QUESTION

So that's the big thing thrown around in addition to the musical evidence, but honestly, I don't think it confirms anything either. As I said in my last post, Daisy Ridley probably hasn't ventured deep into Star Wars lore, particularly backstory lore and Legends/EU lore. She hears a Darth name that she doesn't recognize. There's a big dark side guy in the new movie that isn't named something like Kylo Ren, just a simple Snoke. A lot of dark side guys have had Darth names. I think she was honestly just asking a question of clarification because she was genuinely confused and maybe assumed this guy knew more about the character than she did, or that more information had been released about the character of which she was unaware. I think J.J. Abrams stopped her to try and prevent anyone from going ""SNOKE = PLAGUEIS CONFIRMED!"" but it clearly backfired. Kasdan may have legitimately been confused; he probably hasn't ventured much into the Star Wars lore itself either.

&gt; THE SUPREME LEADER IS WISE

Another popular one. It's a good line, I think. But a lot of characters are ""wise"" and called wise. I think it's just Kylo Ren defending his Supreme Leader... or something along those lines. I mean, indoctrinated peoples probably view their ""guided dictator"" as wise.

&gt; SNOKE JUST LOOKS LIKE A PLAGUEIS... COME ON

Well, considering there is no canonical appearance of Plagueis, this is sort of hard to defend in the first place. But Snoke doesn't look much like a Muun, if we go off of his Legends appearance. A lot of dark side guys physically decay away; that's canon. Heck, just being in the presence of the dark side causes some dudes to sort of melt away, like those Emperor's royal guards who were guarding Sith artifacts that Lando came across in some comic.

&gt; HE SAYS PALPATINE'S LINE

Yeah. Or it's just a parallel to Palpatine, and Snoke sort of fulfills his role in the sequel trilogy either way. It's a common line throughout the saga. Snoke doesn't seem to be conventional Sith anyway just by his physical garb and appearance. But an interesting point you raised as well.

&gt; THEY'VE BEEN CRPYTIC ABOUT SNOKE'S IDENTITY

Honestly... they've also said that Snoke is just Snoke, that Snoke is a new character, and his backstory doesn't matter that much. Rian Johnson himself has said something along the lines of viewing Snoke similarly to the Emperor in the OT; you just don't need to know much about him going forward in the story (whether or not you disagree with him here is another matter - I actually do disagree with him in some ways, but he's the director and writer of the next film, so it may reflect on Snoke's role in that film.) I think this is largely fan interpretation of Snoke, which was inevitable anyway since he's the new big baddie in these three films where that role has been fulfilled solely by Darth Sidious in the past six. It's a sequel to an already established story, so we want to know where this guy came from and how he came to power after Palpatine. I think that Lucasfilm is just making a point that it doesn't really matter. Snoke is Snoke. It's not necessarily cryptic. But there's definitely intentional mystery to his backstory. Also, apparently Snoke's CGI wasn't finished until late into production, hence why we hadn't seen him before the film's release.

&gt; BORROWING FROM THE EU WITHOUT USING IT

Pretty sure the first one is a concept art of the Jedi Killer (Kylo Ren) dueling Kira (Rey) and Sam (Finn), not of the character that would become Supreme Leader Snoke. There's been similar concept art of Kylo Ren in the past too.

&gt; PHYSICALLY SIMILAR

Like I said, there's not much in canon to go off of, but yeah, they could be borrowing from the EU. But really, the only thing to go off here is that they're both aliens. I guess Snoke sort of looks like a  fatter Muun? But Muuns kinda look like generic alien but really thin anyway... so I dunno, this is just a tough one.

&gt; HE ACTUALLY LOOKS LIKE PALPATINE MURDERED THE SHIT OUT OF HIM

That's definitely a possibility, but there could be all sorts of explanations for Snoke's injuries. Injured by the ancient Jedi thousands of years ago. So immersed into the dark side that he's decaying as he delves deeper into it (which the concept art book of TFA hints at anyway). Injured while dueling against Luke Skywalker. Thrown out a window after being electrocuted by Force lightning and falling smack on the streets of Coruscant. Survived the Death Star's explosion at Yavin 4 by Luke Skywalker. Well... okay, maybe not the last two, but you get the point.

&gt; ELEGANCE OF THE STORY

Yeah, I would definitely say that legacy is a big part of the sequel trilogy, which was inevitable anyway since it's the *sequel* trilogy. How much is Plagueis the legacy of Sidious though, considering they had a Master-Apprentice relationship? There are other ways Snoke could be tied to Sidious. Maybe he was an ancient evil creature of the dark side reawakened by Sidious. Maybe Sidious released him when he sent his Contingency officers to the Unknown Regions where he was hearing that dark side voice calling to him and reaching out to him.

&gt; THERE ARE NO SITH IN THE FORCE AWAKENS

Yeah, there's definitely precedent for someone renouncing the Sith and no longer considering themselves to be Sith as seen with Maul in Star Wars Rebels.

&gt; HE'S NOT A MUUN

You take that back! Not all Muuns are ugly! :(

&gt; HE'S AN ANCIENT BEING FROM THE OUTER REGIONS

Actually, there has *never* been an official statement that Snoke is ancient. The most we know about his age is that he's witnessed the rise and fall of the Galactic Empire, which could mean a number of things (maybe he only saw it through Force visions) and Serkis stating that he's aware of the past to a great degree (which again could be Force visions). Lots of people just assume that Snoke is ancient, which isn't totally unreasonable for a variety of reasons. So yeah, we know nothing.

&gt; IT'S SILLY TO HAVE A CHARACTER REINCARNATE/REGENERATE

To be fair, Snoke's CGI wasn't finished until late into production of The Force Awakens and perhaps still wasn't entirely accurate of the character's physical representation that we're finally seeing in The Last Jedi. He was all in the shadows in the actual presentation of the film, and he only appeared as a hologram. Lucasfilm may have given The Last Jedi production team more free rein in Snoke's physical appearance. Maybe he's regenerating or maybe this is just how he's really supposed to look. There's no official confirmation yet though.

&gt; PABLO TWEET

He really could have just avoided replying altogether though. I think there's a difference between beating around the bush and repeatedly not only denying the theory explicitly but *mocking* it. He could have denied it once. But he continues to make fun of it and those who support it, and he's not the only one at Lucasfilm who has done so. It would just be bad PR at this point.

&gt; J.J. DENIAL

To be fair, J.J. Abrams later said he regretted his statements regarding Khan and Into Darkness, so I doubt he would do it again... right?

&gt; CLOSING

Just to make it clear myself, I'm doing this for discussion purposes. Stirring the pot. Acting the contrary. Not trying to be a dick or anything like that. I myself have been on and off with this theory. It's still fun to talk about, I think.",dob2khv,t3_763c6n,,11,starwarsspeculation,,,2017-10-13
Helenius,"Godt brøl søster!

PS: Min kollega udtalte ""The Last Jedi"" som ""The Last Jæddi"" her den anden dag. ",dob81u7,t3_763znz,,9,DANMAG,,,2017-10-13
Xephon7,"Revenge of the Sith is plural.

The Last Jedi is singular. 

",dob03cm,t3_763fj8,,9,StarWars,,,2017-10-13
paper_liger,Snoke is the Last Jedi,doap3zx,t3_75x05e,,9,PrequelMemes,,,2017-10-13
BlindManBaldwin,"&gt; Luke is the antagonist

*breathes in, breathes out*

**WARNING**: Don't read this unless you want a really geeky, self-indulgent ramble. 

I can absolutely 100% guarantee Luke isn't an antagonist. I'll spare you the whole rant and give just the condensed version. 

It would completely go against his character. Luke hasn't been explored too in-depth in new canon yet, but the one constant is he **is** firm in his beliefs. In *From a Certain Point of View*, Obi-Wan sees future Luke (heavily implied to be on Ahch-To) and describes him as ""full of regret and sorrow"". If he was evil, why would he be feeling these things? 

Before you say *But Blindy, Vader feels these things so that's lazy analysis*. Yes, he does. But that's *literally* Anakin's entire character; suffering and self-hatred. So, him feeling regret immediately after becoming Vader (and at varying levels for the next 20 years) is completely in-line with character. 

The whole point of Luke's character (in new canon) is to show that raw power and strength is irrelevant and the true worth of a Jedi comes from their moral compass and dedication. Luke, more than any other character in canon, has the strongest and most unflappable morals. He wasn't going to kill Vader and he wasn't going to become his apprentice either. 

I wouldn't be surprised if we had a scene in TLJ showing that Luke *refused to kill* Ben Solo because of how much Luke doesn't like killing and violence (see *Heir to the Jedi*). The whole point of Luke's isolation in the ST is to emphasize how much he hates war and doesn't want to get involved again.

That's why I find the Yoda/Luke comparisons so lazy and unoriginal. OT Yoda was exiled for a purpose; to one day train Luke (or actually Leia according to *A Certain Point of View*). Luke, as far as we know now (though I doubt this holds but that's just speculation), isn't hiding for any purpose. He just wanted to get away from all the pain and suffering that his family has caused the galaxy. 

Besides it completely going against the thirty-plus year canonical history of Luke's character, it frankly would go against the whole point of the ST. While I have a litany of criticisms about what JJ Abrams did to the series, the one thing I do like is how he showed that our heroes are good people, but still flawed. 

Han Solo is still the lovable, swashbuckling pilot when we saw him on screen last, but he's grown reclusive after his son became a monster. He regressed to his life before he got involved with the Rebellion and was going to live like that for the rest of his days. Leia is still the masterful tactician and leader, but she's full immersed herself in her work to distract herself from the fact that her government (the New Republic) was plagued by the same problems of the old and her regret of sending her son to train with Luke. Luke, meanwhile, responded to this crisis much like other Jedi have before. He hid himself within the force (I wouldn't be surprised if Ahch-To was later revealed to have similar force properties like Dagobah or Mortis) to learn more about the origins and the make-up of the force. 

I'll spare you my personal speculation but it would be very lazy writing and go against the whole spirit of the character (and frankly the franchise as a whole) if Luke was the ""big bad"". I'd honestly check out of the whole ST if they did that. ",dobblok,t3_764q2e,,8,DenverBroncos,,,2017-10-13
InvisibroBloodraven,"&gt; I can't wait to see what he does in the last jedi

Act like Hitler again I would presume. ",dob9xcy,t3_75zylt,,8,movies,,,2017-10-13
PieBlaCon,"**The Amazing - Ambulance**: The Amazing are a Psych Folk band from Sweden (English lyrics, though) that record songs heavy with improv after just 1-2 takes. They might be releasing new music soon, but this release from last year is something else. I come away loving this album more every time I listen to it. It's such a slow burn, and if I had given it a better chance when it came out in July, I would have made a bigger deal about it during list season. It would be top 5 of 2016 if I redid my rankings. The last three tracks of this record are what really do it. It's a good album up until that point, but the closing numbers are on another level. They're a bit slower and the emotion behind the vocals will send you soaring. The atmosphere is simply stunning. The thing is, you might need to give this album time, potentially even with extended gaps between listens. That's what it took for me. [Here's the opener](https://youtu.be/JeSqVrueOrA). Let me know what you think, or if you've already heard of this band/album, do you enjoy it? **8.5/10**

**The National - Sleep Well Beast**: I revisited this one because I couldn't stop saying/singing ""I gotta walk it back, walk it back..."" On the whole, it's a good album. Maybe too long for me, but I'm not really a fan of The National, so it's not that the songs like ""Turtleneck"" and ""Carin at the Liquor Store"" are bad, it's just I wish I could trim the fat. I'm sure longtime fans enjoy the 57min run. **7.5/10**

*New Listens*

**St. Vincent - MASSEDUCTION**: Only one listen, but it's interesting. I actually enjoyed LA and NY as singles (held off on ""Pills"" earlier this week) so my expectations weren't as low as some. [Here's some 2-3 word first impressions on a notepad](http://i.imgur.com/ccvtiFT.jpg)

**Iron &amp; Wine - Beast Epic**: I've pretty much come to terms that I like the idea of I&amp;W better than I like the actual music. Songs like ""Lion's Mane"" and the cover of ""Love Vigilantes"" are such beautiful listens, but when it comes to full length LPs, I come away thinking they're just OK-good (with great individual moments). *Beast Epic* is no different. ""Bitter Truth"" and ""Song in Stone"" whisk me away and are just so pleasant. Other tracks are good, but I usually feel like doubling back to those two. It's a short album, so the fact that it doesn't overstay its welcome is probably why it's my 2nd favorite by Sam (behind the debut), but I just want to like these albums so much more, because they feel so honest. **7.25/10**

**Dirty Protectors - The Glad Fact**: I feel a bit lame for liking this so much, because I know, w/o a shadow of a doubt, that I'd say it was trash if someone played this for me a year ago. Since listening to the s/t album earlier this year (my AOTY), I've gone backwards through their/his discography, and I can't believe how much I had been missing out (I still need to listen to *Slaves Graves and Ballads*). Every single album is, at a minimum, great. I'd consider this one the weakest, but I still really enjoy it. ""Winter is Here"" is a standout, as is ""My Offwhite Flag"", but nearly every track is great. I'm also really shocked at how little this album is written about/listened to online. Very little in the way of articles and YT plays. **8/10**

**Blade Runner 2049**: Loved it. It retains the atmosphere, pace, and world that I enjoyed from the first film, but has better characters, writing, and a more dynamic plot. I will say that Hans Zimmer's score pales in comparison to the 82 classic, as he once again relies on the tired, loud **WOMP**. The only time I was moved by the music was when they re-used a certain track from the original (without spoiling anything) **5 Stars**

**The Last Jedi Trailer**: Lots of misdirection, I think, and I like that. I have no idea where they're going with this one. I wish they didn't show that scene with Rey and Snoke, but I did audibly gasp when I saw that, so it did its job, I guess. So close!",dobb9u1,t3_76545s,,7,indieheads,,,2017-10-13
Quiddity131,"BB6 was amazing! Still probably my favorite season of the show. The first ever episode of Big Brother I saw was a late season episode of BB6, around F5 or so as I distinctly remember Howie and his jedi stuff being featured. That was the only episode I saw while it was airing though, and it wasn't until BB7 that I starting watching every episode and becoming an obsessed fan.

Obviously the cast has several legends, chief among them Janelle. This is easily Janelle's best season, I actually hated her in BB7 and she was a disappointment in BB14. Is she still the most memorable and popular female HG the show has had? I know Rachel seems to be more of the latest big thing, but I would think most would say Janelle. I hope. Overall this was a really good cast. I think you could definately argue there were more duds here than in BB5 (Ashlea? Jennifer before her HOH week? Sarah was nice, but not the most memorable HG, Beau had one epic drunk fight with Janelle but that was about it for him), but so much of this cast delivered and you've got one of the most well liked alliances ever and one of the most hated alliances ever.

The secret partners twist was a great one, one of my favorites (and frankly one I'm surprised they have never used again). Aside from that and the buyback returning, when you think back at it this is kinda a season devoid of much twists. 

The hardcore split in the house, which went from basically week 3 until the end of the show is something we hardly ever see on this show (BBOTT, but that's been about it lately) and I loved. What helped make this season so amazing is just how down the middle it was and that the power shifted every single week. Infact HOHs were swapped from one side to the other every single week the entire season with the exception of the F8/F7 rounds where the Friendship won 2 in a row. It really is absurd how things went down that way, and these days we are quite used to the same side winning HOH over and over and over.

It is not the biggest season strategy-wise, but Kaysar really does pull off quite the feat with his HOH in week 3, putting together the Sovereign Six alliance and backdooring ""Cappy"". Maggie pulls a total mindfuck on Howie with his HOH which permanently puts the Sovereigns in the minority the rest of the season, even with Kaysar's return. Those aside the season is probably more filled with dumb strategic decisions than wise ones. This is our last season for true backdoors, with both Cappy and James going out that way. BB finally puts in the current veto format by introducing random picks with the next season. Only took them to BB7 to get that right!

Boy the fights and drama this season were amazing. Right off the bat we get them with Cappy, Michael, Kaysar and Ivette. The endless breakdowns and sob fests from the Friendship when Janelle won America's Choices, especially when she wasted the phone call from home on Michael, her showmance who got evicted week 2 instead of a family member were hilarious. ""The fans who watch this show are pieces of shit!"" Never forget. And boy, that week that Jennifer screwed over Kaysar was absolute gold. Contains my favorite exchange in BB history:

Janelle: ""Rachel, you're so beautiful!""

Rachel: ""Thanks Janie!""

Janelle: ""Maggie, you're such a bitch!""

Maggie: *stone faced silence*

Anyway, absolute greatness. Very hard to top.",doaka4t,t3_760t89,,7,BigBrother,,,2017-10-13
trebular,"No, sorry, this is the last Jedi. Seriously. My bad.",doahynl,t3_7603ca,,7,StarWars,,,2017-10-13
Samuraistronaut,"I wouldn't either. I hate to see Star Wars jump on the post-credit bandwagon but I don't know how else they'd do it. I've been trying to wrap my brain around how the fuck they're going to market this movie so close to The Last Jedi. So far the marketing cycle has worked well for them - movie, then Blu Ray, then right after that, teaser for the next movie, then a few months later a trailer, then movie. With this, TLJ will be coming out on Blu Ray like two months before Han Solo and everyone will be like ""Wait, there was JUST a new Star Wars movie, what's all this now?"" It's going to hinder promo for Han Solo and if they're not careful, maybe TLJ too.",doautb6,t3_75z55t,,6,StarWarsLeaks,,,2017-10-13
peteykirch,"Part of me hoped when I saw Porgs for the first time, and everyone was like ""D'aww THEY ARE SO CUTE"" that in the course of Star Wars The Last Jedi they would be responsible for a death of a major character like Chewie or Leia.",dobvlp7,t3_765yhb,,6,funkopop,,,2017-10-13
fireinvestigator113,"The best part about the Star Wars movies releasing in the middle of December is that they release either the day of or the day before my birthday so I haven’t paid for tickets. My girlfriend just bought me tickets to The Last Jedi on my birthday and I’m pumped. 

Also the Eagles are scary good. The refs did everything they could to make them lose that game last night. ",dob6qim,t3_763r6i,,6,Colts,,,2017-10-13
jareyesdenver,"A lot of  things happened this week. 

holy shit. I’m so excited for the last Jedi. I WANT A PORG!

And to the issue that’s kept me awake since Tuesday. US Soccer is an absolute disgrace. 3.5 berths exist so the the United States doesn’t miss out on the World Cup, ever. And we still managed to fuck that up. I’ve trashed the MLS for a while now, and I’m gonna trash it even more. This falls on USSF and the owners. We’ve poured over a billion dollars into soccer and can’t field a men’s team to take us to a World Cup. Just pitiful. Last time I ever want to see an MLS player wearing my country’s shirt ever again. Don Garber can go fuck himself. The entire system needs to get blown up. The fact that there as only FIVE players under the age of 25 is astonishing. Gulati and Arena should’ve been fired on the tarmac. Hell, leave everyone not named Christian Pulisic behind in Trinidad and Tobago. ",dobcu3l,t3_764q2e,,5,DenverBroncos,,,2017-10-13
mortalprogeny,"Or it's called the last jedi because snoke IS the last jedi.

The last YOUNGLING jedi...",doatm8t,t3_75x05e,,5,PrequelMemes,,,2017-10-13
OPCKiller,"Got super lucky and 1 packed a 10 cc gold Felicity Jones sig and immediately traded it for a full Reflections set plus both awards. Have never had any Reflections much less a set of them and am not quite sure what to do with myself.  
I’ve never really been all that interested in Reflections actually, so I think my next step is to figure out how to turn these into my last few S1 Vintage and WV needs most efficiently (I’m down to the big ones of course - Han, Death Star, Tarkin, Fully Fledged Jedi; Obi, Duel, Mustafar, both Hyperspace). ",doba5x2,t3_764029,,5,starwarstrader,,,2017-10-13
joosh82,"The new Stranger Things trailer came out today, I mentioned that I'm more excited for that than The Last Jedi and several people went off on me about how ""You do not blaspheme about Star Wars!!!!""

Holy crap, people...it's a movie.",dobvu1d,t3_765yhb,,5,funkopop,,,2017-10-13
iconoclysm,https://a.dilcdn.com/bl/wp-content/uploads/sites/25/2017/08/The-Last-Jedi-Porg-1200x800.jpg,doc39qk,t3_7675sh,,5,EliteDangerous,,,2017-10-13
Oksus69,"Still waiting for my Ulta order to come from last Friday (with the Laura Geller highlighter)... UPS dropped it off at my post office, so hopefully it'll come today? Sometimes they get confused and I have to drive over to pick it up myself... 

I'm already figuring out what makeup look I want to do for the midnight showing of The Last Jedi... I have to do something purple, because I'm a Reylo supporter. A while back there was a Buxom eyeshadow freebie that's a purple/blue duochrome, so that's a strong contender right now. ",dob2hem,t3_763uqt,,5,MUAontheCheap,,,2017-10-13
FM-101,"What if the last movie is called ""From death"", and Obi-Wan gets resurrected as a Jedi that is ""more powerful than you can possibly imagine""",doaii9c,t3_75y2tq,,5,funny,,,2017-10-13
TheCourierWatches,"it's coming with thor ragnarok if i'm not mistaken

or the last jedi",dobxa4h,t3_7651ik,,5,marvelstudios,,,2017-10-13
advancedbunburying,"And we just paid $13-18 for the opening days of The Last Jedi! Tbh, everything is worth it.",doavfof,t3_762ll5,,5,StarWars,,,2017-10-13
