author,body,id,link_id,permalink,score,subreddit,is_submitter,total_awards_received,date
RunDNA,There's going to be a lot of cosplaying Star Wars fans getting fines in Austria at the Last Jedi midnight screenings in December.,do4kdbv,t3_75a1rl,,2790,worldnews,,,2017-10-09
dendlefon,SPOILER ALERT:  Trubisky is the Last Jedi. ,do58qg9,t3_75d5de,,116,CHIBears,,,2017-10-09
enderandrew42,"Right before EA got the rights, Obsidian pitched a game that was going to be a spiritual successor to KOTOR set between Episode III and IV about the last Jedi dying off.",do4emf0,t3_757wuk,,106,StarWars,,,2017-10-09
qiaokexiansheng,"Mike Pence wants to go into The Last Jedi totally blind, and he plans to walk out at the start of the trailer.",do4bto1,t3_757t5a,,72,movies,,,2017-10-09
Martiger434,]Countdown timer](https://www.timeanddate.com/countdown/to?iso=20171009T22&amp;p0=179&amp;msg=The+Last+Jedi+Trailer&amp;font=sanserif) I found on /r/starwarsleaks,do4h4tl,t3_759ti4,,51,StarWars,,,2017-10-09
LilAhsoka,"Return of the Jedi. The last half of the movie is pure perfection the way cuts between the epic space battle, the battle on Endor, and Luke vs Vader.",do58sli,t3_75d2ny,,48,StarWars,,,2017-10-09
Bieber_hole_69,Only way to boost the ratings on that game is to just play the entirety of The Last Jedi instead. ,do4z3eq,t3_75bytv,,40,nfl,,,2017-10-09
JFCDoomblade,Hey only a 2 month wait for The Last Jedi for you! We had to wait 2 agonizing years!,do41dm9,t3_756o9x,,40,StarWars,,,2017-10-09
SetYourGoals,"**THIS**

Everyone needs to read this. The only reason these locations have film is that they are the horrible dome IMAXs, which can only take film I believe. It's worse than seeing it in a standard 2D non-IMAX theater. There are specific IMAX dome films that are great, but they were *designed to be shown in a dome.* Don't get tricked. Regualr films are terrible in dome IMAX. 

/u/BTS_1 you did not see Rogue One or TFA in 70MM at CityWalk. It's an IMAX Laser location, but it has the full sized screen, and will essentially be the full IMAX experience we used to call ""70MM."" It's just not on film. But honestly I think the trade off of lower resolution that is barely perceptible is worth it for the brighter projection and less film/screen issues. If you have a full sized IMAX screen near you, 99% chance they are showing the full sized IMAX version of Last Jedi. 

IMAX, for whatever reason, is fucking terrible at informing the public about their product. They've completely destroyed the branding of what IMAX is, and it's crazy that at this point people like us in this thread have to go out and do their PR job for them. It's exhausting to have to do this every time an IMAX movie comes out. I'm frustrated. ",do3rsiq,t3_75414y,,39,movies,,,2017-10-09
ludwigritcher752,"Near to Blade Runner 2049 runtime, with 163 minutes. The Last Jedi will be literally epic.",do4hc4j,t3_759q1z,,39,starwarsspeculation,,,2017-10-09
VegetaLF7,"The Silencer is his new ship in The Last Jedi, they revealed it in concept art the way they did the crashed SF TIE.",do59fgo,t3_75bfxe,,26,StarWars,,,2017-10-09
gt14199,"Last Jedi tickets also go on sale during the game. It’s my job to buy 12 tickets to the IMAX for opening night, I’m terrified I’m going to fail everybody. The past 2 releases have been crazy tough to secure tickets.",do3yebx,t3_756ye9,,19,minnesotavikings,,,2017-10-09
FazbearADULTEntBS,"I can't wait for the YouTube video that does ""Star Wars: The Last Jedi but it's just Porgs.""",do3lpns,t3_755c0y,,17,StarWars,,,2017-10-09
szeto326,"That's a big if, because from what I've heard, the adult stuff is nowhere near as good as the kid stuff. 

Plus, it's a kind of record that'll be tough to replicate (somewhat related, but it's why I don't think Last Jedi will end up outgrossing Force Awakens worldwide).",do3uwp1,t3_753gdx,,15,boxoffice,,,2017-10-09
RunDNA,"I'll be avoiding it. 

I went overboard on The Force Awakens trailers, watching all the different trailers over and over and watching those fan-made compilation trailers where they edited together every known shot in rough story order. When I finally saw the film too many scenes were way too familiar and it spoiled the movie a bit.

So I watched the Rogue One teaser but steered clear of the proper trailers and I'm doing the same thing with The Last Jedi. Unless you have Alzheimer's you only get to watch a movie for the first time once.",do4fd55,t3_75988w,,14,StarWars,,,2017-10-09
Das_Crussong,"- First day of my 1 week vacation today.    
- Baby daughter is all good.    
- Curious to see the new THE LAST JEDI trailer soon.    
- IT was a cool movie, but not scary at all.    
- Setting up a Poker Night at home next wednesday.    
- Currently i hate my workplace very much.    
- Had my birthday two days ago, now 29.",do4dmx6,t3_759ahy,,13,HollywoodUndead,,,2017-10-09
ThePaleNeon,"Just a *shot* in the dark, but I'm guessing it's because the poster for The Last Jedi is red, we've seen red sand in the trailers, and the color palette theme for this movie seems to be red.

Too out there?",do4ka7m,t3_75a7nk,,13,starwarsspeculation,,,2017-10-09
n107,"The interesting thing is those are all scenes from The Last Jedi trailer. 

This is going to be one surprising movie!",do4bwg5,t3_7592kz,,12,StarWars,,,2017-10-09
isaalacrymosaa,"Wow this analysis is beautiful! 
And yep this is the perfect way to bring the the whills prophecy too 
Yeah they're the balance the Ying and yang
If only made right they said 
By resolving the grey through the last Jedi sight 

So luke is the key to bring that two pieces together  , according to the prophecy
The island will have a symbolic impact in kylo and rey 
I can't wait for the trailer and the final poster 

Also the author of the last Jedi novel said that kylo is a reverse Anakin! ",do4j4fs,t3_757p4c,,12,starwarsspeculation,,,2017-10-09
lifes_a_risk1,"Plot summary of The Last Jedi:

Rey gets separated from everyone else and trains with an old wizened Jedi

Poe flies everyone through an asteroid field, but lie *bigger* asteroids

Kylo reveals he's Rey's family member

Poe gets frozen

the end",do3no49,t3_755ecg,,10,nfl,,,2017-10-09
Kylon1138,"ya, cause I'm sure it would do great up against The Last Jedi  /s",do47x2r,t3_757kl0,,10,movies,,,2017-10-09
Koala_Guru,"I want to say before I tell you this that I'm not trying to be mean, just stating my issues with this review. Tone doesn't convey well in text. I thought that you had a lot of good points, as I think we all can agree the writing wasn't nearly as tongue-in-cheek in the future trilogy. 

So the thing I take great issue with is your thoughts on the added lore. Let's start with Ratchet. One of your biggest complaints was that the charm of his character was that he was a nobody who got drawn into a big conflict, and giving him a history that makes him important ruins that. You also showed a clip from Star Wars to illustrate this. However I think you forgot who Luke is. Yes, Luke started out as a nobody, but later it is revealed that he is much more important than anyone thought. Once Obi Wan and Yoda die, Luke is the last Jedi. Ratchet is the last lombax. Not only that, but Luke is later revealed to be the son of the main villain, and is hinted as being the most powerful force user, or at least having the capacity to be. It's definitely not unheard of for a hero's journey to reveal that their heroes are more important to the grander scope than first let on, and it is definitely not a bad thing to add some backstory to make the universe more deep.

Now about Clank. I think you misinterpreted what the game was saying about Orvus. It wasn't negating his backstory from the first game, it was just supplying added context. You criticize the logic behind many things in this game, so tell me, what is the logic behind Clank being so defective that he looks absolutely nothing like the other robots and has entirely different abilities? The factory still made a defective robot so that it would have valuable information for stopping Drek, but he was never intended to be more than a useful tool for whoever wanted to take him down. It was Orvus' intervention that led to Clank developing a personality and bond with Ratchet, hence why they took special time to show how similar their personalities were. Orvus needed a son and saw an opportunity for one. The reason the Zoni didn't attempt to contact Clank before Tools of Destruction is because there was no need for him since Orvus was still alive.

What I'm trying to say is, there's nothing wrong with adding some depth to characters. It strengthens the ability for storytelling. Reducing characters to their most basic traits is what led to Thieves in Time. ",do3ruiv,t3_753vz5,,10,RatchetAndClank,,,2017-10-09
JediPaxis,Glad you enjoyed it! Luckily you can go straight into Rogue One and only have a couple months to wait for The Last Jedi. ,do40629,t3_756o9x,,9,StarWars,,,2017-10-09
naipagaijo,Went out of my way to see TFA in IMAX 70mm for what probably amounted to less than 1 min of 70mm footage. Do we know how much is actually shot in 70mm for The Last Jedi? I'm not falling for this sleazy marketing ploy twice. ,do3ren3,t3_75414y,,8,movies,,,2017-10-09
arxero,"Slow down?


What?

PREPARE YOUR BUTTS FOR:
THE LAST JEDI Wave 2, THE LAST JEDI SDCC Exclusives, MOVIE MOMENTS Wave 2, HAN SOLO: A Star Wars Story Wave 1, LEGENDS Wave 2, HAN SOLO: A Star Wars Story Wave 2, HAN SOLO: A Star Wars Story NYCC Exclusives, POP Rides Wave 4, More Walgreens Prequel Pops, MOVIE MOMENTS Wave 3, EPISODE IX Wave 1, EPISODE IX Wave 2, EPISODE IX NYCC Exclusives, REBELS Wave 3, POP Rides Wave 5, UNDERWORLD Wave 1, KENOBI: A Star Wars Story Wave 1, KENOBI: A Star Wars Story Wave 2, LEGENDS Wave 3, KENOBI: A Star Wars Story SDCC Exclusives, MOVIE MOMENTS Wave 4, UNDERWORLD Wave 2",do4x066,t3_75a12x,,8,funkopop,,,2017-10-09
that_guy2010,"How?

Are you going to watch Thor Rangnarok, or basically any big movie before Episode XIII comes out? Because if you are I guarantee you they will play a trailer for The Last Jedi before it.

How do you avoid that?",do4n9ye,t3_757t5a,,8,movies,,,2017-10-09
Stalemate9,"This should help.

https://www.timeanddate.com/countdown/to?iso=20171009T22&amp;p0=179&amp;msg=The+Last+Jedi+Trailer&amp;font=sanserif",do4h3qf,t3_759ti4,,8,StarWars,,,2017-10-09
KahAnderson,I'm having such a hard time deciding between doing the 8 movie marathon or the Force Awakens/Last Jedi double feature. ,do500tc,t3_75bzzp,,8,StarWars,,,2017-10-09
SMART_AS_YOU,"Not 100% sure how the system is run, but I don't believe Mark chooses the price. His team/agents who set up his appearance negotiate prices, and with the hype behind The Last Jedi and the passing away of Carrie Fisher; There is a demand for his autograph and they know people will pay for it. It's a kinda corrupt and sad practice. But I guess money is money.... :/",do3p35b,t3_755pzd,,8,NYCC,,,2017-10-09
IMadeThisJustForHHH,"Seriously. I don't think anyone here actually read the tweet. He's basically saying ""if you want to come in clean, don't watch the trailer (no shit), but it's really good"".

People are acting like he said something like ""the new Last Jedi trailer ruins my artistic vision for the movie""",do4k3ny,t3_757t5a,,7,movies,,,2017-10-09
Amandapanda77,"Got an exclusive copy of A Certain POV and even got it signed by one of the authors and got a cool free bag that says ""I find your lack of books disturbing"", saw some props from The Last Jedi, got to pet Swatch from Project Runway, got a cool Jedi bumper sticker and really cool print of a haunted house artwork, and tons of people wanted to take pictures of us in our costumes. ",do4mgdn,t3_75aclo,,7,NYCC,,,2017-10-09
JediPaxis,"He's subsequently [clarified](https://twitter.com/rianjohnson/status/917435186358267904?ref_src=twsrc%5Etfw&amp;ref_url=http%3A%2F%2Fcomicbook.com%2Fstarwars%2F2017%2F10%2F09%2Fstar-wars-the-last-jedi-rian-johnson-avoid-new-trailer%2F) his statement.  

&gt; ""I said IF you want to come in totally 100% clean, avoid the trailer.""",do56okt,t3_75b5xj,,7,StarWars,,,2017-10-09
darthnihiluspenis,"Hoy sale el trailer de The Last Jedi y no doy más del hype. No me importa lo que el resto opine, la idea de ver un trailer completo me tiene al palo.",do4btga,t3_7588qb,,7,argentina,,,2017-10-09
Beefjerky007,"I liked The Force Awakens, and I went in to Rogue One with low expectations. I ended up loving Rogue One even more than TFA. Hopefully The Last Jedi continues the trend of awesome modern Star Wars movies. ",do4utvx,t3_756o9x,,7,StarWars,,,2017-10-09
valkyria_knight881,"While Disney is behind by 200 million right now, they have a chance to keep the crown. Warner Bros' only big movie left is Justice League. Disney on the other hand, has Thor Ragnarok and Star Wars: The Last Jedi. What gives you the idea that Warner Bros will win this year?",do3x9br,t3_755myd,,7,boxoffice,,,2017-10-09
icouldntcomeupwith,[Countdown](https://www.timeanddate.com/countdown/to?iso=20171009T22&amp;p0=179&amp;msg=The+Last+Jedi+Trailer&amp;font=sanserif),do4qi69,t3_759ul6,,6,StarWars,,,2017-10-09
ludwigritcher752,"He already showed remorse after Han's body falling. And in The Last Jedi he will feel the gravity of his decision, a weight in his conscience. He will have to express his sad moral condition to Rey or Leia or both. Maybe to Luke but I doubt it. Probably he will ask for forgiveness and a second chance lost in tears to Rey and Leia. ",do57wcl,t3_75d0qr,,6,starwarsspeculation,,,2017-10-09
Clemario,"I’m also curious about this. I want to watch The Last Jedi at its first showing, at a theater where super fans can gather to fully celebrate the movie. The Irvine Spectrum would be most convenient for me, but I’m wondering if the AMC in Downtown Disney is worth it.",do3t3ev,t3_754coq,,6,Disneyland,,,2017-10-09
smoomoo31,all this AND The Last Jedi trailer tomorrow?,do3u7wp,t3_7559qd,,6,SquaredCircle,,,2017-10-09
Stevebertfan,"Theres hundreds of jedis controlling the galaxy only 20 years before ANH and chewie even meets them in ROTS yet Han talks about jedi and the force like they are a myth.  

Darth vader literally built 3PO yet no mention of anything in the 30 scenes they share in OT.  

“He is our last hope” says obi wan.  He knew of leia when she was born.  

Luke keeps the name skywalker even though the empire clearly controls tatooine in ANH.  

Obi wan talks about discovering anakin and training him in OT with no mention if qui gonn taking him on and him being doubtful about the training. 

Too many weird grey areas to count.  
",do4c1uk,t3_755kn8,,5,MovieDetails,,,2017-10-09
nocoastpunk,I'm sure he will be coming back soon with stickied posts explaining how the last Jedi is going to crash and burn.,do4ke4c,t3_757p8j,,5,boxoffice,,,2017-10-09
ICookTheBlueStuff,"Not exactly sure what it specifically includes besides it starting an hour early but if you look [here](http://www.starwars.com/news/star-wars-the-last-jedi-ticket-offers-and-giveaways) under the opening night events, it's one of three special events that they have (the other two being a TFA and TLJ double feature and a SW marathon). It says: ""These premium events will include exclusive content, Star Wars collectible cards, and a special concession offer. Plus, Star Wars: The Last Jedi will start at 6 p.m. local time, one hour earlier than regular public show times.""",do507aq,t3_75bzzp,,5,StarWars,,,2017-10-09
That1RandomKid,For those of you who avoid watching trailers online. How do you avoid watching them in the theaters before other movies? I'm seeing Thor next month and the new Last Jedi trailer will most likely play before it. Do you guys honestly just close your eyes and plug your ears? Haha,do46p1t,t3_7513o6,,5,StarWars,,,2017-10-09
Shtogus,Doubt they’ll put out a new Black Panther trailer on Jimmy Kimmel the same night they’re putting a new Star Wars: The Last Jedi trailer on Monday Night Football,do3nksq,t3_752tut,,5,marvelstudios,,,2017-10-09
DeliciousPatties,"They will probably come out as a free download when the Last Jedi DLC drops, pre orderers just get them early as a bonus.",do58gi8,t3_75d400,,5,StarWarsBattlefront,,,2017-10-09
JediPaxis,"Yeah, it's not hard. [Here you go.](https://www.timeanddate.com/countdown/launch?iso=20171214T18&amp;p0=179&amp;msg=The+Last+Jedi+hits+theaters+in...&amp;ud=1&amp;font=slab&amp;csz=1)",do3xo6u,t3_754zpr,,4,StarWarsLeaks,,,2017-10-09
Eegeria,"Ho la febbre, ma sono felice: non sono andata a lavoro, sto praticando i kanji e stanotte esce il trailer di The Last Jedi. Va bene cosi. ",do4dmyp,t3_756dd4,,4,italy,,,2017-10-09
HavidDume,"Waiting for tonight's Last Jedi trailer, then heading to a theater here to pick up tickets. I can't trust the online stuff after serve issues with Rogue One and Force Awakens. ",do4hh8b,t3_758pdt,,4,Charlotte,,,2017-10-09
jarchh,"If you look at the CLS event, we used A New Hope characters to get the ESB version of Luke. So it'll likely be Force Awakens characters to get the Last Jedi version of Rey.",do41ty4,t3_755mrq,,3,SWGalaxyOfHeroes,,,2017-10-09
PM_DOLPHIN_PICS,"I agree! I'm also trying really hard to have an open mind about the prequels. I have plenty of gripes with TFA, but I think overall it was a good film, and I don't think its fair to judge it, or even The Last Jedi, until the entire trilogy is released. This is the first time since the OT that we've been given a Star Wars story where we have absolutely no idea what's going to happen, and I'm keeping my mind open until I can judge the sequel trilogy in full.",do3t14s,t3_751mqs,,3,StarWars,,,2017-10-09
NukeWithG,"The new Star Wars film, The Last Jedi",do47j13,t3_757rbj,,3,ABoringDystopia,,,2017-10-09
ThetaSigma11,"As a wise man once told me, for all of you stating this is from the sequel, it is the prequel for the Last Jedi.",do3ynjq,t3_751ohk,,3,freefolk,,,2017-10-09
HTTVChannel,No chance.  Tonight belongs to The Last Jedi.,do4epcq,t3_759grf,,3,marvelstudios,,,2017-10-09
LefthandedLunatic,[Director of Star Wars Last Jedi say to avoid the next trailer](https://www.gamespot.com/articles/star-wars-the-last-jedi-director-says-maybe-you-sh/1100-6453878/),do4h8j7,t3_7592hs,,3,neoliberal,,,2017-10-09
_This_Is_Stupid,"To start with this: Constructive criticism (i.e. ""If you swap to farming X here instead of there, you achieve goal Y faster, free up resources to pursue your goal Z faster, and get this extra thing too!"") is always appreciated; criticizing my priorities (i.e. ""You should be pursuing this goal unrelated to anything you mentioned!"") isn't--just don't.

So, let's start with the Credit shop:

Gear. That's it. And it's only with credits, unless CG screws up and apologizes with 500 crystals, and then I pick up the Mk III holoprojectors, AKA the Drain of Hope. Last count, I needed 1200 salvage (including fusion furnaces) to complete my characters, and anything that gets me through that faster is fine by me. I'm going to work the Clones in soon here, so that way I can get Princess Zody going. But, realistically, that's a few months out from here.

Cantina Store: Right now, Poe Dameron. Why? Well, I've got him 5 stars, and I can get 1-2 shipments a day. That's 37 days till I 7 star him, and I anticipate a need to have him at 7 stars December-January timeframe. So, getting him ready in advance will save any sort of panic on my part. After this, FOO, since I don't have him 7 star. Then? Well, that's two and a half months from now, or so. I'll figure it out then.

Guild Store: Resistance Trooper, and just now Jyn Erso. RT is 5 star, needs 7 star for aforementioned reason of December/January anticipation, and Jyn is pretty awesome and will help with TB, so there we go. My gear concerns here actually are much lower now that I'm in a good guild, as opposed to my old one, and we raid on a consistent schedule and people participate and follow rules. Good times.

Squad Arena: I'm finishing Cassian Andor right now, but I've got5 shards left, which means tomorrow morning, I finish that farm. That leaves...
Ugnaught or CUP. Entirely for TB purposes. And, yes, to 7 stars. That's just how I've decided to farm characters from now on, and both will take ~70 days to complete. After that? Well, I'll figure it out. Sidious or Savage perhaps, or HK. We'll see what appeals to me then.

Galactic War: K2SO, and Plo-Koon's Jedi Fighter. I don't have it to the level I want it, and I just realized how useful it would be for certain challenges, and perhaps even fleet arena, so that's an investment for me. I happen to really enjoy fleet battles, so I actually get what I want from doing this.

Mod Store: I do not have the credits or crystals to bother with this, so rarely check in and see if there's anything that's even marginally worth it.

Fleet Store: Primarily, I'm doing whatever shows in the lowest left corner if I don't already have it 7 stars--so, TFP, FOTFP, and Clone Sergeant. I'll also pick up blueprints for rare Dark Side ships like Slave I and TIE Advanced. If I have 2k extra, I'll pick up a zeta mat, if it doesn't preclude an opportunity in the upcoming shipments. Given my overall status for these characters, that's ~50 days (there are 4 that rotate approximately equally through there, they're mostly 5 stars, I can pick up 3 shipments from that location a day, so that's how the math works out.)

Guild Events Store: GEAR! Whatever difficult to farm gear that I see is my priority here, provided I have an immediate use for it. This means getting my arena team to G11-12, and improving gear of my Resistance, FO, and Rebels for various purposes. Also, if I see shards of difficult to farm characters, such as Baze, I'll pick them up.

Shard Shop: Whatever gear that I can afford to get that advances my gear goals. There is a literally zero chance I will invest in Grievous at this time, and if I wanted to invest here, I'd do it in the Fleet shop, which I'm not doing.

Cantina Energy: Today/Tomorrow/Saturday: Speed mods, then Critical Chance mods. After that? Old Ben. I took a 5 day break from farming him so I could get a bunch of mods to put on Phoenix for Thrawn, and get a bunch for when CLS comes back. After I 7 star Old Ben, I'm taking a week off to farm mods again, then it will be Finn, then Kylo. After that, I'll be looking at the mod situation, and possibly going after Captain Han then. I recognize at this rate, I'll get ROLO well before Captain Han, which is irony at its finest, but I'm all about getting a solid base.

Normal Energy: Right now, all hard nodes. I'm prioritizing FOST, and otherwise I'm using my energy on nodes that give shards and gear, or Baze/Shoretrooper/Nihilus/Ghost/Phantom II (because of the Chimaera thing--only to 5 stars, then we'll see after that). Other than FOST, I have no major focus here, which is suboptimal here, but I'm in no particular hurry for any of those guys.
So that's my farm. It's how I'm enjoying the game, and putting things that I want in a nice queue. Feel free to share yours!",do3vwro,t3_753uio,,3,SWGalaxyOfHeroes,,,2017-10-09
mega512,I stopped when The Last Jedi pops came out.  I can't keep up with this form of collecting.  I moved on.,do4bkui,t3_758wlq,,3,funkopop,,,2017-10-09
-Chase,"Well, I can help you with a few of these:

* CtrlP -- Check. I have set a keybind for &lt;ctrl&gt;p to open a fzf-tmux pane that lets me quickly switch files in the project. I've done the same for &lt;user&gt;e to quickly edit files in the directory that I opened kakoune.
* Jedi-vim &amp; vim-go are supported according to the IRC channel
* vim-tmux-navigator -- if you created panes using kakoune (there are built in commands for tmux-new-horizontal/vertical) then there are built in commands to focus said pane. Doesn't work for new tmux windows, though that may be a bug, because the command is there.
* vim-gitgutter -- this works, but I haven't checked how much is implemented in it.
* slimux -- check? I believe all this does is let you send commands to a different tmux pane. That means all it really does is wrap your tmux-keybinding with the command "":set-buffer &lt;text&gt;"" and "":paste-buffer -t 0:1.2"". With kakoune, I have it set so a command "":ide"" will set up my top pane and split it in the bottom pane to allow build commands. If you wanted, you could instead set it up differently. I also know there is a command called ""tmux-repl-horizontal/vertical"" which creates a pane for repl interaction. Perhaps that's what you're looking for?
* Solarized dark colorscheme is available by default, but in need of a small re-vamp. I could do this for you in minutes if you desired. Personally I'm rocking a 256 colorway so I don't get annoyed with mosh :( There are lots and lots of themes available outside the main repo too. For instance base16 themes are mainted by a user for kakoune.

I didn't knoe these last three you mentioned, so I asked the IRC channel. They said nerdtree is replaced by ranger or nnn; Kakoune can compile stuff asynchronously but neomake is a different thing; There is no tagbar.

They also wanted me to share these two links with you:

* kakoune's ecosystem is growing steadily day after day: https://github.com/search?q=topic%3Akakoune&amp;type=Repositories
* other vim plugins to kak migration: https://github.com/mawww/kakoune/wiki/Migrating-from-Vim-popular-plugins (someone said maybe syntastic is relevant for the neomake question)

I hope this helps, and I know the growing pains in switching is hard, so if you have any more questions please feel free to ask! The IRC is #kakoune on freenode",do4i0aa,t3_74n6y2,,3,linux,,,2017-10-09
