author,body,id,link_id,permalink,score,subreddit,is_submitter,total_awards_received,date
takto_,"I kinda don't understand some of your arguments. 

&gt; Gon and his friends had to think outside of the box to solve their problems. Now, it seems all they have to do is spam their Nen abilities.

I don't understand what you mean by ""spam"" Nen abilities since Gon has collapsed before from spamming his Jajanken (in the v Razor and v Knuckle fight). They've more often used strategy to defeat their opponents with Nen abilities only being part of the strategy. Examples being, Gon and Killua's fights with the guys from the Heaven's Arena, Gon v Genthru, Netero, Morel and Knov's way of thining Chimera ants, Gon v. Owl and Bat, Morel v. Leol.

&gt;  Instead, it just gets retconned into Nen, making his title as a ""Magician"" kind of meaningless when everybody with a Hunter's License could do neat tricks.

Personally, I never really attributed Hisoka's ""Magician"" title to Nen, honestly. I think that it fits him because, he is really good at tricking people, like how he tricked the Phantom Troupe about his fortune or Killua with his contacts, with Bungee Gum and Texture Surprise being just a tool that aids his trickery.      

&gt; By the time we got to the Chimera Ant arc, Nen turned into a Superpower Lottery.

If you mean that the abilities of the other hunters seemed fit for what they were doing, then wouldn't it be because of the Association picking the right people for the job?

Now, my input in one of your arguments.

&gt; How is this energy source that every Hunter and their mother can use, or at least knew of, was never mentioned until three arcs in. That'd be like if Luke Skywalker didn't find out about the Force until ""Return of the Jedi."" I get Gon not knowing about it since he had a sheltered upbringing, but why not Killua, whose family uses Nen like as if they were bodily functions? Why did Kite use a katana instead of his Nen Scythe when he rescued Gon?

The realistic reason would be that the rules for Nen wasn't completely fleshed out yet when the manga had started. My head canon would be that Killua's family needed him to know how to be strong without Nen first and intended to teach him when he got older but he ran away. With the latter, I really don't understand, why conjure something random when he had a perfectly good katana to use?

With your JJBA comparison, you say that Stands never got mentioned until the plot needed it; wouldn't that be the same with Hunter X Hunter and Nen? Learning Nen is the last part of the Hunter Exam, so isn't it natural that Gon would learn it after he became a hunter? 

As something that annoyed me, I don't know if your statement about Ki Attacks is directed towards Hamon or Nen but, after reading about Hamon (I'm not a Jojo Fan), aren't you severely underselling both of them with it? It is one thing to say that a power is similar to others with ""rules"" being the only difference but it's a completely different thing to summarize abilities that, while simple in principle, relies on the user's own ability to use them effectively as ""Ki Attacks with convoluted explanations"". ",docem99,t3_769ar6,,18,HunterXHunter,,,2017-10-14
Vried,"It's a toss up between:

Logan Sama's last set on Rinse even with all the needle issues.

Christmas Day 2005 Rinse set has practically everyone and any set opening with Skepta and Scorhcer switching verses on 'Burial' is amazing.

The Movement Sidewinder set (if only for Wretch on Low Deep's 'Jedi')

Renegade Boys' Sidewinder.

I can't decide.",dodbcji,t3_76e2we,,18,grime,,,2017-10-14
heatonism,"aka, the finnless last jedi",docjnbs,t3_76900h,,18,StarWarsLeaks,,,2017-10-14
Elliquin,Because Darth Bane's rule of two is known to the Jedi Order. They believed that the last Sith died long ago. The appearance of Maul told them that the Sith were still at large.,dod0pkc,t3_76cq25,,17,PrequelMemes,,,2017-10-14
lordq11,"Looks like this is CRS13! This raises my hopes of a December launch of FH. I really hope they launch at around the same time as The Last Jedi release, as that would nicely mirror how they achieved their 2015 RTF and first booster landing. It boggles my mind to think how far they've come in just two years!",docobpw,t3_76aqsb,,14,SpaceXLounge,,,2017-10-14
worstdamnday,Rogue one was way better than the last Jedi to me. I think it might be the best prequel ever made.,dodjm62,t3_76f4ui,,13,StarWars,,,2017-10-14
Ryan_HCAFC,"There was one the other day with the ""I've seen this raw power once before"" line from the new Last Jedi trailer and the second panel was Jar Jar swinging from the cannon of that AAT on Naboo. It tickled me. There's also been at least two versions of the new film poster which have been Jar-Jared. ",dodatbf,t3_76cex4,,9,PrequelMemes,,,2017-10-14
diddykongisapokemon,If trailer views indicated box office Thor Ragnarok would open to more than The Last Jedi.,doc7gjm,t3_767h1u,,8,boxoffice,,,2017-10-14
AnOrdinaryDropkick,"That would be fun too. I would love to play as one of the last Jedi, fighting clones at the Jedi Temple, while everything burns and crumbles around me.",docn5e4,t3_76b25j,,8,StarWarsBattlefront,,,2017-10-14
yknphotoman,Powers the Last Jedi confirmed. ,dochx9n,t3_7698xw,,8,CFB,,,2017-10-14
arcantiger,"LOl, first of all, where does the myth of Luke the Most Power Jedi Ever comes from? I don't care about EU and from GA PO. movies that the only canon. So please point out where it was said that Luke was the most powerful. He was the last but not the most powerful. He didn't defeat Vader in ROTJ cause he was more powerful or better but because Vader wasn't going for a kill. It's a classic ""I'll lose the fight so that I don't have to kill you"" moment. Vader didn't use all his strength and that's that. Then Palpatine attacked Luke who was all ""oh, I;m in paiiiiiin, ahhhhh, need help, please daddy do something!"" 

So, again, where is it that Luke is the most powerful Jedi? I don't see it and no one ever said so anyway. It wasn't shown and it wasn't told. So what's happening now is perfectly in character. Rey and Kylo are something new in the Force User Universe. ",docr6mj,t3_76900h,,7,StarWarsLeaks,,,2017-10-14
xxnklmicxx1,"1) the Jedi were sworn protectors of the republic (meaning the republic was good) but palpatine rose to the rank of chancellor and slowly amassed too much power and turned the republic into the empire. 

2) Vader was killed by the emperors force lightning. The emperor was killing Luke, but at the last minute darth Vader turned on him and threw him down a big hole, getting electrocuted in the process. 

3) Yoda died of old age after training Luke in return of the Jedi

4) we really don't know. There's a lot of speculation that rey is Luke's daughter but tbh I don't see it going that way. Could be wrong of course, but I don't think Rey's parent will be important to the story

5) dooku was a Jedi master that got fed up with the corruption of the senate and the ineffectiveness of the republic
",docqcvv,t3_76blt7,,7,StarWars,,,2017-10-14
orrisrootpowder,anyone have the fake last jedi trailer they reacted to?,docwlkd,t3_76bxq4,,7,RedLetterMedia,,,2017-10-14
VeninGrey,I'm sure it'll come back in December. They'd be stupid not to with the hype Last Jedi will bring. ,docbuoo,t3_764w87,,6,swtor,,,2017-10-14
DrYoshiyahu,"It's pretty old news, by now. The Last Jedi DLC will come some time in December and feature Finn and Captain Phasma as the first DLC heroes.",dod6mwm,t3_76doab,,5,StarWarsBattlefront,,,2017-10-14
nishlesh,"i think the next black panther trailer will come with thor ragnarok and infinity war trailer with the last jedi
",doc77xr,t3_7651ik,,5,marvelstudios,,,2017-10-14
altimax98,"No, you want this. Like movie trailers with vertical bars because they are wider than 16:9 fill out the width with no or reduced bezels. The new Last Jedi trailer looks amazing on it because it is almost a 100% fit",doc8cg4,t3_768i5u,,4,GooglePixel,,,2017-10-14
1Glitch0,Did you watch The Empire Strikes Back? If so you've been really spoiled for Last Jedi.,dod6jt8,t3_76bxq4,,4,RedLetterMedia,,,2017-10-14
lifeisthefire,"Finn and Rey are only ever going to be friends. Rey's either going to go the Jedi way and stay single as a pringle or the last movie is going to end with the beginning of a Rey, Kylo relationship.


",docl26v,t3_768892,,4,starwarsspeculation,,,2017-10-14
Snickfalls,"What are your thoughts on a possible Reylo romance developing in The Last Jedi, and/or Episode IX?",docwx50,t3_76bzv1,,4,IAmA,,,2017-10-14
hanburgundy,"It is for some. Notice my last sentence: 

&gt;If you want to truly *discover* The Last Jedi, it's in your best interest to stay away from the TV spots.

Emphasis on the *if*. Some people want to see and know as much as they possibly can, and that's cool too. If that's you, I highly recommend r/starwarsleaks , it's a great sub. But for me, I prefer to be surprised on first watch. ",dod441u,t3_76d8do,,4,StarWars,,,2017-10-14
WetKitchen,"Wow I relate to this so much, haha I’ve finally found someone who is bothered by the scale as much as I am! Here’s to a better sense of scale in the last Jedi :) From what we’ve seen it will likely deliver in that regard. Not only in the battles but the scope of the locales too, another area which was sorely lacking.",dochbhs,t3_7647to,,3,StarWarsBattlefront,,,2017-10-14
EdgarAllenPoDameron,"Resistance C-Wings were uses by the resistance at the time of the last jedi. They were used to take on heavily armored vehicles and were also used in dog fights. It holds 1 pilot and has 10 individual back engines. On the side of the cockpit are 2 rotating laser cannons. On the inner side of the cockpit is a laser cannon and a ion bomb launcher . And at the opposite side of the ship is a heavy cannon, 2 long rapid fire cannons and a missile launcher. It also has shielding and a hyper drive.",doczojd,t3_76cxj3,,3,lego,,,2017-10-14
INTPClara,"Why don't you want to run into anyone you know?

I'm okay doing stuff alone although I do have tickets with a friend for *The Last Jedi.* ",dodfcdj,t3_76e12b,,3,INTP,,,2017-10-14
Matt59823,"I was just looking over some dates, and around 1,000 BBY is when the Jedi made their last affront against the Sith and managed to ""defeat"" them. Before babe reformed the order with the rule of two. 

You could for a campaign idea of a group of Jedi set to hunting down with on the run. Slowly taking them down to assure the eventual breakdown of the south empire. Keep in mind that the Sith back then weren't just Force wielders. They also had large armies and affiliations with worlds that supported their charge for galactic rule. I'm sure there are sourcebooks and the likes for this!",docbzqn,t3_76231w,,3,starwarsd20,,,2017-10-14
idejmcd,"I like the way the Clone Wars are portrayed into the movie, and the way the Clones are integrated into the overall plot and mythos of Star Wars is pretty neat.  The idea that these troops where a ticking time bomb for the Jedi is just cool.

That being said, lots of room for improvement not unlike most of the prequels.  My biggest gripe is how little time the movies actually spend dealing with the Clone Wars.  Episode 1 could have kicked off with an adult Anakin being discovered and the Clone Wars beginning.  Instead we get, IMO, a lot of setup and filler to set the stage for Ep2.  But then in Ep2 we have almost the same thing again, a whole lot of setup, introducing the Clones, and the first battle of the Clone Wars only taking place in the last moments of the movie.

S overall, yea, they pulled the Clone Wars off pretty well but could have spent more time establishing the clones in Episode 1.",docsgwz,t3_76990n,,3,StarWars,,,2017-10-14
SlamSlayer1,Jedi Outcast and Jedi Academy. The last two games of 5 in the Dark Forces/Jedi Knight series. One of the older ones had live action cutscenes like a movie and another let you play as Mara Jade.,dod3h0q,t3_76cecw,,3,StarWars,,,2017-10-14
paintnick,"OK there used a be a tradition at a Christmas party I used to attend where all the kids would get a gift from Santa.  I decided one year to do a biro sketch of my friend Nick, frame it, wrap it up and put it in the bag for Santa to give out.  Adults don't normally get presents so I remember seeing the shock and bewilderment on his face when his name was called out to collect his gift.
Nick is an all around great guy hes done a lot for other people and he's always up for a laugh.  He paints stuff himself and I know he appreciates art and that was part of the motivation behind doing it.
I am not going to sugar coat this- the drawing I did, it was a monstrosity.  I am not arty, I am not talented, I know the paintings are hideous...but do you know what?  I enjoyed doing it. In my mind I reflected on his 'surprise' on opening it.  I smiled the whole time drawing it.  The thing is I thought nick would instantly recognise that only I would be so daft to do something like this would be me, but he didn't.

He didn't have a clue.

So I did it again the next year, and the year after and the year after that. In fact it must be about 6 years I have painted him.  He still has no idea who it is. Each year I go with a theme.  I visited Rome one year and was inspired by the great masters,  Star wars came out one year so I made him a Jedi (with an unintended mullet), I also painted him slaying a dragon riding a unicorn.  I think that was my best one.

I know from my sources that Nick takes the painting home, puts it under the tree and opens it Christmas Morning.  He is desperate to know who did this and has been for years.  Now I planned on doing this for the next 20 years but unfortunately Nick has been diagnosed with cancer and this is probably going to be his last Christmas.
I want to do something special. 
I am keen to make this last one a good effort so I want to commission an awesome portrait for him.  A one that him and his kids can look at with fondness that represents how much of an awesome guy he is. So my plan is to give him the portrait along with 'revealing' myself this Christmas. I might even wrap myself up to.

 I am looking for someone/people (with more skills than me) to, draw/paint a portrait of him, or even if they wanted to do some digital artwork that would be awesome.   I hope the mods don't kills this.",dod7yc9,t3_76e0rp,,3,mildlyinteresting,,,2017-10-14
Vaxis7,"""Season"" just means periodic updates with some common theme. Like The Last Jedi season in December.

It's all free for all players.",dodgdyx,t3_76euuk,,3,StarWarsBattlefront,,,2017-10-14
Scype_crisis,I think marvel is gonna release infinity war trailer when the last jedi is out ,docf8by,t3_7684p9,,3,malaysia,,,2017-10-14
mflourishes,I haven't watched the second Last Jedi trailer due to spoilers. Do they actually discuss it and/or show parts from that trailer?,docuyh9,t3_76bxq4,,3,RedLetterMedia,,,2017-10-14
Jessica_1983,"Online sales. I'm old enough to remember when box office sales weren't reported till Monday evening on Entertainment Tonight. Now there's more advance sales than in-person sales. Take a look at Star Wars: The Last Jedi. It already sold for its opening weekend in most places. Even if 25% refunded because they couldn't make it, you know they'll immediately sell those tickets to someone else. The Last Jedi already made its opening weekend money... and it's October.  ",dodboqz,t3_76bgj8,,3,boxoffice,,,2017-10-14
T_H_G,This thread is attempting to explain how Rey and Chewie could end up on Supremacy. https://thecantina.starwarsnewsnet.com/index.php?threads/in-progress-google-doc-compilation-of-the-last-jedi-rumors-spoilers.52108/page-3,doddp15,t3_769ztq,,3,StarWarsLeaks,,,2017-10-14
10TailBeast,Their official designation is the [AT-M6](http://www.starwars.com/news/inside-two-deadly-new-first-order-vehicles-from-the-last-jedi).,doccsgo,t3_75dxvp,,3,StarWars,,,2017-10-14
Mister_Ferro,"&gt; It is looking at it's first sub-40% drop, likely thanks to Friday the 13th. With 315 million after the weekend and Halloween upcoming, it's still possible that it tops Spider-Man to be the number 4 movie of the year domestically (though that will likely drop to 6 due to Justice League and The Last Jedi).

If the estimate holds then IT will be ahead of SMH by $8.9 mil on the 38th day of both movies. 

SMH made an additional $26.87 mil more since, putting SMH ahead of IT by $18.04. SMH should be done before Halloween while IT could/should get a expansion and gross an additional $20 plus mil.
",docxphm,t3_76bgj8,,3,boxoffice,,,2017-10-14
S4G3T34,"I usually wouldn't mind. I like to do lots of stuff alone too. Something about it being a Saturday night and knowing lots of people who live right next to the theater. That was the rationalization against going, the resistance to doing what I knew deep down was my best choice.

So the real reason is not what I was superficially telling myself before hand in the moment, but instead a larger pattern of fear and negativity discouraging me from getting out of my place, taking risks, and doing stuff. 

Thanks for asking and enjoy that The Last Jedi your friends. I plan to do the same. ",dodjhyn,t3_76e12b,,3,INTP,,,2017-10-14
TheHumanSpider,"I was seriously considering buying the ticket just to get the poster, but I found out the posters only 13' x 19'. 

Source: https://www.fandangofanshop.com/star-wars-the-last-jedi-payoff-poster/",doc5dgd,t3_761zng,,2,starwarscollecting,,,2017-10-14
RPDRNick,"May: ""Oh my god! When is the trailer for The Last Jedi coming out?""

June: ""Oh my god! When is the trailer for The Last Jedi coming out?""

July: ""Oh my god! When is the trailer for The Last Jedi coming out?""

August: ""Oh my god! When is the trailer for The Last Jedi coming out?""

September: ""Oh my god! When is the trailer for The Last Jedi coming out?""

October 9: Here's the trailer for The Last Jedi!

October 10: ""Ugh. Trailers spoil everything.""

November: ""Are we going to get another trailer for The Last Jedi?!""

December: ""Ugh. This is just a rip off of Empire.""",docfbo1,t3_769uru,,2,movies,,,2017-10-14
WuTangFlanimals,"I actually believe that the 4th Star Wars after The Last Jedi will be the best. I have no reason to believe this, nor evidence, but neither do you, so who cares.",docm38g,t3_76au6q,,2,movies,,,2017-10-14
mrglass8,"It's crazy that we have decided Mario Odyssey will be great before it came out, but I get it, because so have I.

I've also done it with Star Wars: The Last Jedi. There is just so much good surrounding those media I don't see how they can't come out amazing.",doctkfv,t3_76byvw,,2,nintendo,,,2017-10-14
Khantemplative,"Warning: Last Jedi Spoilers.

I wish I had never watched the trailer. Why would you make one that spoils basically the entire movie?",doc774s,t3_764q55,,2,Planetside,,,2017-10-14
chekeymonk10,"Yeah. Kilo is actually the Last Jedi, and Kylo is sent to go kill him.

That works too. ",docv62h,t3_76ab3w,,2,StarWars,,,2017-10-14
KodiakTlingit,"GW is essential early on. I don't run Resistance, but I heard they are great at GW. I do own Phoenix and have cleared GW every day for the last 3 weeks.

They base nodes off of your overall power level. Mine is just short of 500k, but higher tier players don't have a good time in GW because of certain toons.

I say one of those two factions or maybe NS, Ewoks or Rebels overall. My Jedi didn't do too great, but the other factions feature more revives which can be helpful.

But do it when your power level is low. Until CG fixes certain toon limitations or something, when you get higher you won't be as successful.

May the Force be with you.",dodermy,t3_76eo8f,,2,SWGalaxyOfHeroes,,,2017-10-14
PrecedentialAssassin,"Really, Joe? I thought he was probably thinking about how the new Last Jedi trailer gave away too much",doc7hsn,t3_768hxx,,2,baseball,,,2017-10-14
staaszekk,"Not just the force awakens, but the last jedi and IX too.",docirje,t3_765sdo,,2,PrequelMemes,,,2017-10-14
