title,selftext,subreddit,score,upvote_ratio,total_awards_received,full_link,link_flair_text,author,id,permalink,url,num_comments,date
The Office meets The Last Jedi,,DunderMifflin,13415,,,https://www.reddit.com/r/DunderMifflin/comments/75tgpc/the_office_meets_the_last_jedi/,,Kicker36,75tgpc,/r/DunderMifflin/comments/75tgpc/the_office_meets_the_last_jedi/,https://i.imgur.com/vAbXoDA.jpg,252,2017-10-12
If Pixar made Star Wars The Last Jedi,,movies,7344,,,https://www.reddit.com/r/movies/comments/75wme7/if_pixar_made_star_wars_the_last_jedi/,,Pirate_Redbeard,75wme7,/r/movies/comments/75wme7/if_pixar_made_star_wars_the_last_jedi/,https://i.imgur.com/K6cVbe6.jpg,280,2017-10-12
If Pixar made Star Wars The Last Jedi,,StarWars,5185,,,https://www.reddit.com/r/StarWars/comments/75wnbc/if_pixar_made_star_wars_the_last_jedi/,Fan Creations,Pirate_Redbeard,75wnbc,/r/StarWars/comments/75wnbc/if_pixar_made_star_wars_the_last_jedi/,https://i.imgur.com/K6cVbe6.jpg,204,2017-10-12
The Last Jedi Trailer But Every Lightsaber Sound Replaced With Owen Wilson Saying Wow [Poetry],,youtubehaiku,3408,,,https://www.reddit.com/r/youtubehaiku/comments/75tdt4/the_last_jedi_trailer_but_every_lightsaber_sound/,Meme,waterguy48,75tdt4,/r/youtubehaiku/comments/75tdt4/the_last_jedi_trailer_but_every_lightsaber_sound/,https://www.youtube.com/watch?v=pvERJ7CSD8I,41,2017-10-12
If Pixar made Star Wars The last Jedi,,funny,3024,,,https://www.reddit.com/r/funny/comments/75wnmc/if_pixar_made_star_wars_the_last_jedi/,,Pirate_Redbeard,75wnmc,/r/funny/comments/75wnmc/if_pixar_made_star_wars_the_last_jedi/,https://i.imgur.com/K6cVbe6.jpg,96,2017-10-12
Star Wars: The Last Jedi poster by BossLogic,,StarWars,2345,,,https://www.reddit.com/r/StarWars/comments/75tt2y/star_wars_the_last_jedi_poster_by_bosslogic/,Fan Creations,Reddit__PI,75tt2y,/r/StarWars/comments/75tt2y/star_wars_the_last_jedi_poster_by_bosslogic/,https://i.redd.it/vm3yuxjyzarz.jpg,232,2017-10-12
[OC] Kylo Ren cinemagraph from The Last Jedi trailer,,StarWars,569,,,https://www.reddit.com/r/StarWars/comments/75zq2t/oc_kylo_ren_cinemagraph_from_the_last_jedi_trailer/,Fan Creations,Randevu,75zq2t,/r/StarWars/comments/75zq2t/oc_kylo_ren_cinemagraph_from_the_last_jedi_trailer/,https://i.redd.it/jxvl61twjgrz.gif,42,2017-10-12
What Luke really meant in The Last Jedi trailer,,2007scape,394,,,https://www.reddit.com/r/2007scape/comments/75yepr/what_luke_really_meant_in_the_last_jedi_trailer/,Humor,Vanhiz,75yepr,/r/2007scape/comments/75yepr/what_luke_really_meant_in_the_last_jedi_trailer/,https://i.redd.it/7kcvcuvalfrz.jpg,11,2017-10-12
MRW someone said this sub doesn’t have any gifs from The Last Jedi,,starwarsgifs,285,,,https://www.reddit.com/r/starwarsgifs/comments/75uuy6/mrw_someone_said_this_sub_doesnt_have_any_gifs/,TLJ,aaronr93,75uuy6,/r/starwarsgifs/comments/75uuy6/mrw_someone_said_this_sub_doesnt_have_any_gifs/,https://i.imgur.com/wiBvglq.gifv,3,2017-10-12
Cosmetic Only Loot Crates Would be Beneficial for Everyone,"In my opinion, EA could actually make MORE money by having RNG loot crates that are COSMETIC ONLY. I mean think about it, basically no on actually is excited about loot crates. The people who hate them obviously won't buy them and everyone who defends loot crates that I've seen say they still won't buy them. If they did cosmetic items, people who be buying crates left and right because one, it's Star Wars and I feel like people would go crazy over cool skins for their favorite characters/ troopers (like clone markings, Luke Skywalker The Last Jedi skin, etc) and stuff like emotes and victory poses. Also, people would buy them because cosmetic only loot crates don't impact the game and are far more pro consumer and people would recognize that, appreciate it, and support it.",StarWarsBattlefront,181,,,https://www.reddit.com/r/StarWarsBattlefront/comments/75zvvx/cosmetic_only_loot_crates_would_be_beneficial_for/,,iiNovaYT,75zvvx,/r/StarWarsBattlefront/comments/75zvvx/cosmetic_only_loot_crates_would_be_beneficial_for/,https://www.reddit.com/r/StarWarsBattlefront/comments/75zvvx/cosmetic_only_loot_crates_would_be_beneficial_for/,37,2017-10-12
AT-AT landing craft in The Last Jedi trailer,,starwarsspeculation,136,,,https://www.reddit.com/r/starwarsspeculation/comments/75tn3m/atat_landing_craft_in_the_last_jedi_trailer/,SPECULATION,CosmoKrammer,75tn3m,/r/starwarsspeculation/comments/75tn3m/atat_landing_craft_in_the_last_jedi_trailer/,https://i.redd.it/jm2gk8tkuarz.jpg,33,2017-10-12
When you see that The Last Jedi will have an invasion of a rebel base by walkers that face speeders and the main antagonist will invade the base with a personal squad of stormtroopers,,PrequelMemes,108,,,https://www.reddit.com/r/PrequelMemes/comments/75tr8f/when_you_see_that_the_last_jedi_will_have_an/,,MavikVCT,75tr8f,/r/PrequelMemes/comments/75tr8f/when_you_see_that_the_last_jedi_will_have_an/,https://i.redd.it/fr1wpft5yarz.png,19,2017-10-12
My new desktop for the Last Jedi,,StarWars,105,,,https://www.reddit.com/r/StarWars/comments/75vx8p/my_new_desktop_for_the_last_jedi/,,Harrigasm,75vx8p,/r/StarWars/comments/75vx8p/my_new_desktop_for_the_last_jedi/,https://i.redd.it/50lwg07tddrz.jpg,12,2017-10-12
This group of old men try to beat each other at Bingo...,"You're hosting the bingo game, problem is, this isn't a normal retirement home...

Luke Skywalker (The Last Jedi), old Wolverine (Logan), Kratos (GoW PS4), Uncle Iroh (A:TLA), Batman (Frank Miller's TDKR), Heihachi (Tekken), and Master Roshi (Dragon Ball) are playing the game. Everyone is sitting at separate tables, and everyone knows how to play the game.

R1: They've all agreed to play the game fairly.

R2: Everyone is Bingo-Lusted (AKA cheating and sabotaging).

R3: The winner of Bingo must protect you as the others get out of their seats to kick your ass.",whowouldwin,99,,,https://www.reddit.com/r/whowouldwin/comments/75ut1s/this_group_of_old_men_try_to_beat_each_other_at/,Casual,GodzillaOfWar,75ut1s,/r/whowouldwin/comments/75ut1s/this_group_of_old_men_try_to_beat_each_other_at/,https://www.reddit.com/r/whowouldwin/comments/75ut1s/this_group_of_old_men_try_to_beat_each_other_at/,27,2017-10-12
[Video] | The Empire Strikes Back Trailer (Edited like The Last Jedi Trailer). For my star wars nerds. weirdly got a bunch of frisson. Listen with sound all the way up!!,,Frisson,81,,,https://www.reddit.com/r/Frisson/comments/760hni/video_the_empire_strikes_back_trailer_edited_like/,Video,ADTR20,760hni,/r/Frisson/comments/760hni/video_the_empire_strikes_back_trailer_edited_like/,https://www.youtube.com/watch?v=rqvGCyWRKjU,11,2017-10-12
"The titles and thumbnails of videos after searching ""last jedi"" in YouTube",,starterpacks,60,,,https://www.reddit.com/r/starterpacks/comments/75xt8j/the_titles_and_thumbnails_of_videos_after/,,momoneymomorrison,75xt8j,/r/starterpacks/comments/75xt8j/the_titles_and_thumbnails_of_videos_after/,https://i.redd.it/7dzpwbby5frz.png,3,2017-10-12
"[THEORY] Does this Last Jedi trailer breakdown give us the REAL story of how Ben Solo became the ""Jedi Killer""? Discuss!",,starwarsspeculation,49,,,https://www.reddit.com/r/starwarsspeculation/comments/75tt4s/theory_does_this_last_jedi_trailer_breakdown_give/,THEORY,saffroncake,75tt4s,/r/starwarsspeculation/comments/75tt4s/theory_does_this_last_jedi_trailer_breakdown_give/,http://starwarsnonsense.tumblr.com/post/166266818694/the-last-jedi-trailer-breakdown,69,2017-10-12
My local movie theater representing The Last Jedi...,,StarWars,44,,,https://www.reddit.com/r/StarWars/comments/75zr3z/my_local_movie_theater_representing_the_last_jedi/,movies,aasisgaas,75zr3z,/r/StarWars/comments/75zr3z/my_local_movie_theater_representing_the_last_jedi/,https://i.imgur.com/ehNcIih.jpg,8,2017-10-12
Raw power,"Interesting that almost every time they mention Rey's power in Databank, it is raw.

""Kylo swore his loyalties were only to Snoke. But he was intrigued when he captured Rey, a Jakku scavenger whose Force abilities were **raw** but very powerful. A mysterious connection seemed to link the two.""

""Rey's Force powers were **raw**, but growing."" 

""Fueled by anger and **raw** power, Rey defeated Kylo.""

[Link](https://imgur.com/a/t523r)

Another interesting thing that I noticed is Kylo's goal.

""A dark side warrior with a mysterious past, Kylo Ren was neither Jedi nor Sith, but a product of both sides’ teachings. Once an apprentice of Luke Skywalker’s, he killed his fellow students and drove Skywalker into exile, becoming a First Order warlord and servant of Supreme Leader Snoke. Kylo was ***determined to destroy the last remnants of the Jedi***, fulfilling the legacy of Darth Vader.""

""Neither Jedi or Sith, Kylo used the pain of his emotional conflict to fuel his extraordinary powers, and **dedicated himself to destroying the last traces of the Jedi tradition**."" 

[Link](https://imgur.com/a/t523r)

Interesting, it seems that both Luke and Kylo want the same thing. ",starwarsspeculation,41,,,https://www.reddit.com/r/starwarsspeculation/comments/75whx3/raw_power/,DISCUSSION,special_cases,75whx3,/r/starwarsspeculation/comments/75whx3/raw_power/,https://www.reddit.com/r/starwarsspeculation/comments/75whx3/raw_power/,22,2017-10-12
Made a quick wallpaper from The Last Jedi trailer (AT-ATs),,ultrawidemasterrace,40,,,https://www.reddit.com/r/ultrawidemasterrace/comments/75u487/made_a_quick_wallpaper_from_the_last_jedi_trailer/,,sogard_the_viking,75u487,/r/ultrawidemasterrace/comments/75u487/made_a_quick_wallpaper_from_the_last_jedi_trailer/,https://i.imgur.com/qsRb4Yq.png,9,2017-10-12
The Last Jedi poster by BossLogic (edited for all you Yellow eye Sith fans),,StarWars,29,,,https://www.reddit.com/r/StarWars/comments/75x17q/the_last_jedi_poster_by_bosslogic_edited_for_all/,Fan Creations,el_toastradamus,75x17q,/r/StarWars/comments/75x17q/the_last_jedi_poster_by_bosslogic_edited_for_all/,https://imgur.com/a/NFjEr,2,2017-10-12
"What if Pixar made ""The Last Jedi""? by Augen2",,StarWars,28,,,https://www.reddit.com/r/StarWars/comments/75vx70/what_if_pixar_made_the_last_jedi_by_augen2/,Fan Creations,narwi,75vx70,/r/StarWars/comments/75vx70/what_if_pixar_made_the_last_jedi_by_augen2/,https://imgur.com/gallery/56cde,9,2017-10-12
New The Last Jedi trailer hints at Snoke's true identity,,SequelMemes,28,,,https://www.reddit.com/r/SequelMemes/comments/75uysc/new_the_last_jedi_trailer_hints_at_snokes_true/,,moxillaq2,75uysc,/r/SequelMemes/comments/75uysc/new_the_last_jedi_trailer_hints_at_snokes_true/,https://i.redd.it/4jq04xvv4crz.jpg,2,2017-10-12
The Last Jedi Trailer - Remade in Destiny 2,"https://youtu.be/QWu_fXuRNPk

I once again combine my two favourite franchises in this reimagining of the latest Star Wars The Last Jedi Trailer. The new cinematics and the narrative focus that Destiny 2 brings really let me play around and have some fun. Enjoy!",DestinyTheGame,27,,,https://www.reddit.com/r/DestinyTheGame/comments/75tslq/the_last_jedi_trailer_remade_in_destiny_2/,Media,Pollywog117,75tslq,/r/DestinyTheGame/comments/75tslq/the_last_jedi_trailer_remade_in_destiny_2/,https://www.reddit.com/r/DestinyTheGame/comments/75tslq/the_last_jedi_trailer_remade_in_destiny_2/,6,2017-10-12
Luke is Snoke's ultimate goal,"**At first** i think Disney marketing team are devil creatures that misdirect, mislead us and shift our focus.

**At second** i think with the new trailer and all that confusion about Rey and Kylo being the OP Force Users we started to forget that the main goal of FO, Kylo and Snoke was to find Luke. The whole movie spinned around this idea.

Just notice how skillfully marketing team shifted our focus from Luke to Rey and Kylo as those who Snoke find as his mcguffins, while in TFA Snoke didn't give a damn about Rey until Kylo randomly found something strange about her, and be honest didn't do anything towards Kylo that make us feel that Kylo is special snowflake with giant potential. Kylo was a useful tool.

Having this in mind, take a look at the new trailer where we heard Snoke's: **""When i found you i saw raw, untamed power and something truly special...""** and then **""Fulfill your destiny""** paralleled visually with Kylo and Rey.

What we did? We jumped on speculations about Kylo and Rey hidden potential. In many cases that new info was confusing especially when the trailer show us scared weak Luke.

 ""How those two are more powerful than Anakin's son Luke???""
Answer is simple.

**They aren't.**

Thats the trick i talked about. Misdirection, misleading, shifting the focus.

If we'll put aside them and take into account everything we fond out in TFA, we will be able to see things clear and logically right.

 I won't go into details since they weren't revealed yet, so **just an outline now.**

When Luke defeated Emperor, saved the father and became the Jedi, some ancient creature beyond the Unknown Region felt the changes in the Force. He found the source of these changes in Luke. That creature, named Snoke, saw in Luke raw untamed power and something truly special. And thats right. Luke was a Jedi after RotJ but he wasn't studied enough to be the Master of the Force. And he was the son of Chosen One, the most powerful Force User of (not that important) all times. 

Since then, Snoke began his journey. He wanted to get Luke, and earlier or later, Luke found out Snoke's presence. It doesnt mater, during what stage he did it. 

Snoke made his move, and destroyed New Academy, and took away Kylo.
Thats when Luke realized that creature wants to get him. Thats why Luke escaped and hide on Ach-To. Maybe Acho-To has some sort of defense from Snoke, as its the place where was built the first Jedi Temple.

Here comes The Last Jedi. **Snoke wants to make Luke reveal himself. Kylo and Rey are potent Force Users, but they are not OP prodigies as trailer suggests. They are tools in the hands of Snoke.**

And thats why he ordered Kylo to kidnap Rey. Not to do something evil with Rey. **Snoke wants Luke to leave Ach-To to rescue Rey.**

And i bet that what he will get by the end of the TLJ. I will be not surprised if Luke is in that scene where Snoke tortures Rey, behind the shot. 

""Fullfill your destiny"", - Snoke tells to Luke who stands before him. 

That scene mirrors both ESB, RotJ and RotS scenes, where Vader and Palpatine used third persons (Leia and Han/Vader/Palpatine) as the leverage to turn the focus person (Luke/Luke/Anakin) to the Dark Side.
Its like a poetry, it rhymes. Luke comes to the rescue to save Rey, but instead falls in trap and being tempted by the Dark Side User.

**Thats Snoke's ultimate goal. He sees in Luke the power of Anakin, and he wants to use it for own sake.**",starwarsspeculation,26,,,https://www.reddit.com/r/starwarsspeculation/comments/75tbfb/luke_is_snokes_ultimate_goal/,THEORY,Harbournessrage,75tbfb,/r/starwarsspeculation/comments/75tbfb/luke_is_snokes_ultimate_goal/,https://www.reddit.com/r/starwarsspeculation/comments/75tbfb/luke_is_snokes_ultimate_goal/,18,2017-10-12
When I see the Last Jedi trailer,,PrequelMemes,25,,,https://www.reddit.com/r/PrequelMemes/comments/75z7bf/when_i_see_the_last_jedi_trailer/,,xwing_23,75z7bf,/r/PrequelMemes/comments/75z7bf/when_i_see_the_last_jedi_trailer/,https://i.redd.it/dn3qkdbd6grz.png,2,2017-10-12
3 things to watch for tonight (from Eagles fan who lives in Charlotte),"Hey, I am a huge Eagles fan living in Charlotte so I have seen probably 50-60 Cam Newton games beginning to end in the last 5 or 6 years.  It's not a small sample size. 

Here are three things to watch out for as a fan.

1. Cam's velocity seems to be angel soft lobs or 90 mile an hour Randy Johnson fastballs.  His fast throws help him get away with ill advised passes to guys who aren't open...but they get the ball because it's so damn fast. Kind of like how Ryan Howard on the Phillies was so strong he could hit a home run off of a low outside ball...off the tip of the bat.  Speed kills.  
HOWEVER*
The velocity comes back to bite him on short passes because when the ball gets tipped, it careens 40 feet straight up in the air a few times a game and it becomes a tip drill straight from Madden 2002 hell.  The whole defense stares up at the ball and waits patiently...

2. Cam is FAR more likely to take off when the potential throw requires him to cross his body.  If we pressure him, watch for D to pressure him to his LEFT.  Going left makes him want to jet.  He has done well going to his left like his touchdown to Ed Dickson last week, but that was a designed bootleg and he had no Lions players nearby.    

3. Cam doesn't move very suddenly in the pocket. He's fast, but he's not ""sudden.""  He stands very non-chalantly, very casual.  He can tuck it like the best of them, but in the pocket he glides backwards for a while and will take a sack once in a while when throwing it away seemed possible.  
The Eagles must be disciplined though because Cam doesn't need a lot of windup on his throws.  He can correct his feet and shoulders and drive a 70 yard pass in the air--I've seen him.  Rivers and Manning hit 70 yard bombs on us but Cam can get it there with a lot of ease compared to those elder QBs.  
      I will be getting loud in the 508 section in my Wentz jersey next to a girl dressed like a Jedi. Maybe you'll see me on TV.  My pick for the game is Eagles 30 Panthers 20.  BONUS: The panthers drafted Kenjon Barner and it would be tragically ironic if he became a difference maker in this game. They never gave him much respect in Carolina so watch him play his ass off against his old team with a couple of big punt returns that could prove instrumental in an Eagles win.  Go Birds
",eagles,22,,,https://www.reddit.com/r/eagles/comments/75z8qv/3_things_to_watch_for_tonight_from_eagles_fan_who/,Opinion,AssEnthusiast666,75z8qv,/r/eagles/comments/75z8qv/3_things_to_watch_for_tonight_from_eagles_fan_who/,https://www.reddit.com/r/eagles/comments/75z8qv/3_things_to_watch_for_tonight_from_eagles_fan_who/,16,2017-10-12
THE LAST JEDI TRAILER but with Sith Lord Jar Jar Binks || PARODY,,DarthJarJar,21,,,https://www.reddit.com/r/DarthJarJar/comments/75uaqo/the_last_jedi_trailer_but_with_sith_lord_jar_jar/,Meta,huktheavenged,75uaqo,/r/DarthJarJar/comments/75uaqo/the_last_jedi_trailer_but_with_sith_lord_jar_jar/,https://www.youtube.com/watch?v=RGuX0xAbGjU&amp;feature=share,2,2017-10-12
Will The Last Jedi be good?,,AskOuija,19,,,https://www.reddit.com/r/AskOuija/comments/76112f/will_the_last_jedi_be_good/,Ouija says: DOUGHNUT,SnakeHugz,76112f,/r/AskOuija/comments/76112f/will_the_last_jedi_be_good/,https://www.reddit.com/r/AskOuija/comments/76112f/will_the_last_jedi_be_good/,10,2017-10-12
What if Luke tried to train Kylo as first Grey Jedi (or somehow balanced force user) and it went bad?,"From databank (last screen https://imgur.com/a/t523r) about Kylo Ren: 

""A dark side warrior with a mysterious past, Kylo Ren was neither Jedi nor Sith, but a product of both sides’ teachings. Once an apprentice of Luke Skywalker’s, he killed his fellow students and drove Skywalker into exile, becoming a First Order warlord and servant of Supreme Leader Snoke. Kylo was determined to destroy the last remnants of the Jedi, fulfilling the legacy of Darth Vader.""
""Neither Jedi or Sith, Kylo used the pain of his emotional conflict to fuel his extraordinary powers, and dedicated himself to destroying the last traces of the Jedi tradition.""

What if Luke learned about balance and how it must be preserved. He learned something like the stronger is the force wielder the bigger threat HIS anger is. And at some point in life everyone is getting mad - so Luke thought that he should learn him how to controll his anger. This is my guessing, bringing shit out of hat etc. but the core of my theory is that...

Luke did want to teach him both about light and dark side, Kylo was kind of Lukes experiment that went bad - he could not controll his power and destroyed everything. It would make both Lukes and Kylos fail. Somehow Kylo could not embrace the dark side and went mad destroying the temple. After the failure Luke went on exile and Kylo felt guilty because he was not strong enough to controll himself. So to finish his training and to prove he is not a dissapointment he HAD to embrace the Dark Side and he needed a teacher. Luke did not know much about the Dark Side and also withdraw so the only option for Kylo was Snooke. And look how desperate Kylo is to do ""dark side things"". He even killed (or more like forced himself to) his own father so he could ""learn the dark side"".

",starwarsspeculation,15,,,https://www.reddit.com/r/starwarsspeculation/comments/75zszc/what_if_luke_tried_to_train_kylo_as_first_grey/,THEORY,TheGejsza,75zszc,/r/starwarsspeculation/comments/75zszc/what_if_luke_tried_to_train_kylo_as_first_grey/,https://www.reddit.com/r/starwarsspeculation/comments/75zszc/what_if_luke_tried_to_train_kylo_as_first_grey/,9,2017-10-12
[US-GA] [H] Star Wars last Jedi sets and ninjago movie Destinys bounty. [W] PayPal.,"https://imgur.com/a/upMl9

Album with pictures and a timestamp 

Looking to get $450 for all of these. Would really rather sell all together as a lot to save on shipping hassles, but if you're interested in buying only one of these, PM me and we'll see if we can work something out. 


Sets listed:

75187 Bb-8

75188 Resistance Bomber

75190 First Order Star Destroyer

70618 Destiny's Bounty

They're all brand new and sealed, only selling because I need the cash to get a new car. PM me if you have any questions about the sets. ",Legomarket,14,,,https://www.reddit.com/r/Legomarket/comments/75zduy/usga_h_star_wars_last_jedi_sets_and_ninjago_movie/,,Yondu_the_Ravager,75zduy,/r/Legomarket/comments/75zduy/usga_h_star_wars_last_jedi_sets_and_ninjago_movie/,https://www.reddit.com/r/Legomarket/comments/75zduy/usga_h_star_wars_last_jedi_sets_and_ninjago_movie/,1,2017-10-12
Not Speculation - Where did this fascination with all the OT people dying come from?,"Like, would anyone be pissed if 'The Last Jedi' died? Every conclusion I've read is Han, Luke, Leia are dead. Great. 

We Killed off Han

Leia died due to uh... offscreen issues I'm sure it will be explained in VIII.

Does luke **have to die**? Can he just be a Jedi Master?

Jedi do not have Rule of 2.

",starwarsspeculation,13,,,https://www.reddit.com/r/starwarsspeculation/comments/75u6u0/not_speculation_where_did_this_fascination_with/,,LaLaurie87,75u6u0,/r/starwarsspeculation/comments/75u6u0/not_speculation_where_did_this_fascination_with/,https://www.reddit.com/r/starwarsspeculation/comments/75u6u0/not_speculation_where_did_this_fascination_with/,28,2017-10-12
Star Wars : The Last Jedi but the Porg has a URSS flashback,,dank_meme,13,,,https://www.reddit.com/r/dank_meme/comments/75x465/star_wars_the_last_jedi_but_the_porg_has_a_urss/,,catnipbag,75x465,/r/dank_meme/comments/75x465/star_wars_the_last_jedi_but_the_porg_has_a_urss/,https://www.youtube.com/watch?v=ClOqpxsrXJU,3,2017-10-12
"""The Last Jedi"" - The Disney Version",,StarWars,12,,,https://www.reddit.com/r/StarWars/comments/75z3k4/the_last_jedi_the_disney_version/,Fan Creations,Uebelator,75z3k4,/r/StarWars/comments/75z3k4/the_last_jedi_the_disney_version/,https://i.redd.it/23syuq7n3grz.jpg,7,2017-10-12
Luke and Snoke’s fear,"I’ve been worried about how Luke is going to be portrayed in The Last Jedi. He’s the hero for me. I’ve been worried he’s been put into the back seat just so the other characters can breathe. 

But, it’s Snoke’s words in the TFA that give me heart. Snoke seems generally afraid and worried of Luke returning. He literally wants to bring the FO out of hiding to destroy the resistance before they reach Skywalker. 

I don’t know what this means other than Snoke is clearly worried about Luke returning. That makes me equally concerned to know what is keeping him away. ",starwarsspeculation,10,,,https://www.reddit.com/r/starwarsspeculation/comments/75xxib/luke_and_snokes_fear/,,epigenetic,75xxib,/r/starwarsspeculation/comments/75xxib/luke_and_snokes_fear/,https://www.reddit.com/r/starwarsspeculation/comments/75xxib/luke_and_snokes_fear/,4,2017-10-12
How is no one talking about this leak from the Last Jedi trailer?,,PrequelMemes,8,,,https://www.reddit.com/r/PrequelMemes/comments/75xn5f/how_is_no_one_talking_about_this_leak_from_the/,,NAHHHBRO,75xn5f,/r/PrequelMemes/comments/75xn5f/how_is_no_one_talking_about_this_leak_from_the/,https://imgur.com/a/nXU4c,1,2017-10-12
I made a Porg poster today in anticipation for The Last Jedi!,[deleted],StarWars,8,,,https://www.reddit.com/r/StarWars/comments/75tiz9/i_made_a_porg_poster_today_in_anticipation_for/,Fan Creations,[deleted],75tiz9,/r/StarWars/comments/75tiz9/i_made_a_porg_poster_today_in_anticipation_for/,https://i.redd.it/pq1vg8m6rarz.jpg,0,2017-10-12
