title,selftext,subreddit,score,upvote_ratio,total_awards_received,full_link,link_flair_text,author,id,permalink,url,num_comments,date
The Last Jedi Trailer - 80s/90s VHS Disney Style,,videos,0,,,https://www.reddit.com/r/videos/comments/767a4j/the_last_jedi_trailer_80s90s_vhs_disney_style/,,SweetJustice2,767a4j,/r/videos/comments/767a4j/the_last_jedi_trailer_80s90s_vhs_disney_style/,https://www.youtube.com/watch?v=um5evW5pnt0,0,2017-10-13
The Last Jedi Trailer - 80's/90's DISNEY VHS STYLE,,StarWars,0,,,https://www.reddit.com/r/StarWars/comments/767nuw/the_last_jedi_trailer_80s90s_disney_vhs_style/,Blog/Spam,JuanTheGonz,767nuw,/r/StarWars/comments/767nuw/the_last_jedi_trailer_80s90s_disney_vhs_style/,https://youtu.be/um5evW5pnt0,1,2017-10-13
If Steve the Stormtrooper was in The Last Jedi trailer 😂,,starwarsmemes,0,,,https://www.reddit.com/r/starwarsmemes/comments/768mme/if_steve_the_stormtrooper_was_in_the_last_jedi/,,Twalk132,768mme,/r/starwarsmemes/comments/768mme/if_steve_the_stormtrooper_was_in_the_last_jedi/,https://www.youtube.com/watch?v=U4QoX5NLOZI&amp;t=4s,0,2017-10-13
Cant wait for star the last jedi wars,,CrappyDesign,0,,,https://www.reddit.com/r/CrappyDesign/comments/763wtj/cant_wait_for_star_the_last_jedi_wars/,,ma_boi1,763wtj,/r/CrappyDesign/comments/763wtj/cant_wait_for_star_the_last_jedi_wars/,https://i.redd.it/k9e1olazqkrz.jpg,1,2017-10-13
Star Wars actors react to The Last Jedi trailer (not all were impressed),,StarWars,0,,,https://www.reddit.com/r/StarWars/comments/7649a3/star_wars_actors_react_to_the_last_jedi_trailer/,Movies,stangers85,7649a3,/r/StarWars/comments/7649a3/star_wars_actors_react_to_the_last_jedi_trailer/,https://www.youtube.com/attribution_link?a=lO0WHDXRa5E&amp;u=%2Fwatch%3Fv%3D150Eh0quoCQ%26feature%3Dshare,3,2017-10-13
"There is much more to this interview with Daisy. It is scripted but straight up spoils the The Last Jedi. Watch at your own caution, and interpret how you wish, I don't even want to point them out",,StarWars,0,,,https://www.reddit.com/r/StarWars/comments/761inr/there_is_much_more_to_this_interview_with_daisy/,Off-Topic,WayneGretzky66,761inr,/r/StarWars/comments/761inr/there_is_much_more_to_this_interview_with_daisy/,https://www.youtube.com/watch?v=doUdRCrK80E,21,2017-10-13
[US-CA] [H] Star Wars The Last Jedi Costco Exclusive Glow in The Dark 4 Packs (Rebel/First Order) [W] Trades from wantlist,"[Proof Pics](https://imgur.com/a/aUUwN)

I have a set of Costco exclusive Star Wars 4 packs (Rebel/First Order) with glow in the dark Rey and Kylo Ren and am looking to trade for something off my [wantlist](https://www.poppriceguide.com/guide/member/wantlist/funkosaurusrex/1SLBH64SBYICYH69/)

Both boxes are in Mint-Near Mint condition. I am an in-box collector so trades would need to be in a Mint-Near Mint box as well. 
",funkoswap,0,,,https://www.reddit.com/r/funkoswap/comments/767rez/usca_h_star_wars_the_last_jedi_costco_exclusive/,Trading,FunkosaurusRex,767rez,/r/funkoswap/comments/767rez/usca_h_star_wars_the_last_jedi_costco_exclusive/,https://www.reddit.com/r/funkoswap/comments/767rez/usca_h_star_wars_the_last_jedi_costco_exclusive/,3,2017-10-13
Star Wars : The Last Jedi - Poster by ArtBasement,,StarWars,0,,,https://www.reddit.com/r/StarWars/comments/767lz5/star_wars_the_last_jedi_poster_by_artbasement/,Movies,ArtBasementOfficial,767lz5,/r/StarWars/comments/767lz5/star_wars_the_last_jedi_poster_by_artbasement/,https://i.redd.it/s67a2vcgsnrz.jpg,2,2017-10-13
The Last Jedi - Spoiler Free Trailer,,StarWars,0,,,https://www.reddit.com/r/StarWars/comments/766he9/the_last_jedi_spoiler_free_trailer/,,andrewtrim39,766he9,/r/StarWars/comments/766he9/the_last_jedi_spoiler_free_trailer/,https://youtu.be/01y5_mGHxUY,4,2017-10-13
I found a similarity to Episode 3 in the new Last Jedi trailer,,StarWars,0,,,https://www.reddit.com/r/StarWars/comments/762fsm/i_found_a_similarity_to_episode_3_in_the_new_last/,Movies,TheAjalin,762fsm,/r/StarWars/comments/762fsm/i_found_a_similarity_to_episode_3_in_the_new_last/,https://imgur.com/a/sN8t8,2,2017-10-13
LEAKED FOOTAGE FROM THE LAST JEDI!!,[deleted],videos,0,,,https://www.reddit.com/r/videos/comments/7623dd/leaked_footage_from_the_last_jedi/,,[deleted],7623dd,/r/videos/comments/7623dd/leaked_footage_from_the_last_jedi/,https://www.youtube.com/watch?v=DvUQ9Vbn0S8,0,2017-10-13
[media] Star Wars: The Last Jedi Trailer - Both Trailers Remixed to support a theory...,[deleted],starwarsspeculation,0,,,https://www.reddit.com/r/starwarsspeculation/comments/762t6q/media_star_wars_the_last_jedi_trailer_both/,THEORY,[deleted],762t6q,/r/starwarsspeculation/comments/762t6q/media_star_wars_the_last_jedi_trailer_both/,https://www.youtube.com/watch?v=XTBLlREs-84&amp;feature=youtu.be,2,2017-10-13
Steelberg (iamsteelberg) just released an excellent edit of the Star Wars: The Last Jedi trailer,[deleted],movies,0,,,https://www.reddit.com/r/movies/comments/766xa2/steelberg_iamsteelberg_just_released_an_excellent/,Media,[deleted],766xa2,/r/movies/comments/766xa2/steelberg_iamsteelberg_just_released_an_excellent/,https://vimeo.com/237975208,0,2017-10-13
"I'm a professor who has published books on Star Wars and Blade Runner, AMA","...and with both Blade Runner 2049 and The Last Jedi trailer out this week, I thought now might be a good time to talk to Reddit.

Ask me anything about Blade Runner, Star Wars and the other stuff I've written about (retro video games, Batman and superheroes, Alice in Wonderland, David Bowie) ... or about academia, PhDs, becoming a professor, getting that kind of book published.

Here's some more about me and my background: https://en.wikipedia.org/wiki/Will_Brooker

Proof, fresh from my office at work: https://imgur.com/a/NVWzt


---------
EDIT: I've now been answering questions for 3 and a half hours solid, and have 150 still to answer... I'll keep going as long as I can. Thanks for all the discussion so far!

--------

EVERYBODY HATES EDITS: I've been answering questions for 5 hours 15 minutes now and my hands are really taking the strain. I'll come back tomorrow, around 8am GMT, and give it another shot. 

I appreciate all the questions, especially the ones asking if I'm 'professor of edge', or in Chemical Romance, or Green Day, or if I'm Draco Malfoy or a scary street magician.


-------

**EDIT 3** I've now put in 2 and a half more hours on a Sunday and I'm afraid I have to prepare my teaching for Monday, or my students won't have a good time.

Sorry that I didn't get to all the questions, though I think some of them were repetitions of things I've already answered, or more comments about my hair. I may be able to read and respond more during the week, but I hope you understand I am juggling a lot of work.

Thank you all for making this such a fascinating experience and discussion. ",IAmA,6929,,,https://www.reddit.com/r/IAmA/comments/76bzv1/im_a_professor_who_has_published_books_on_star/,Academic,willbrooker,76bzv1,/r/IAmA/comments/76bzv1/im_a_professor_who_has_published_books_on_star/,https://www.reddit.com/r/IAmA/comments/76bzv1/im_a_professor_who_has_published_books_on_star/,1256,2017-10-14
Rey has Qui Gon's Hair in the last Jedi.,,starwarsspeculation,209,,,https://www.reddit.com/r/starwarsspeculation/comments/76cvgc/rey_has_qui_gons_hair_in_the_last_jedi/,MEDIA,Jayttic,76cvgc,/r/starwarsspeculation/comments/76cvgc/rey_has_qui_gons_hair_in_the_last_jedi/,https://i.redd.it/usqpzp0phtrz.jpg,50,2017-10-14
We all know who Luke was REALLY referring to in the Last Jedi trailer...,,JonTron,200,,,https://www.reddit.com/r/JonTron/comments/76ex95/we_all_know_who_luke_was_really_referring_to_in/,,Drokash,76ex95,/r/JonTron/comments/76ex95/we_all_know_who_luke_was_really_referring_to_in/,https://i.redd.it/u3kiccgo6vrz.png,6,2017-10-14
4k The Last Jedi Poster (Fan Edit),,StarWars,177,,,https://www.reddit.com/r/StarWars/comments/76bvuz/4k_the_last_jedi_poster_fan_edit/,Fan Creations,Subject18,76bvuz,/r/StarWars/comments/76bvuz/4k_the_last_jedi_poster_fan_edit/,https://i.imgur.com/dzkG2p0.jpg,8,2017-10-14
Loving all the beautiful red cinematography in The Last Jedi,,moviescirclejerk,150,,,https://www.reddit.com/r/moviescirclejerk/comments/76ewpq/loving_all_the_beautiful_red_cinematography_in/,,1080TJ,76ewpq,/r/moviescirclejerk/comments/76ewpq/loving_all_the_beautiful_red_cinematography_in/,https://i.redd.it/aoxudyf66vrz.jpg,10,2017-10-14
New Luke Skywalker 'The Last Jedi' Lines from Toy,,StarWarsLeaks,105,,,https://www.reddit.com/r/StarWarsLeaks/comments/769ztq/new_luke_skywalker_the_last_jedi_lines_from_toy/,Merch,steve40,769ztq,/r/StarWarsLeaks/comments/769ztq/new_luke_skywalker_the_last_jedi_lines_from_toy/,https://streamable.com/29rzu,76,2017-10-14
Rey is rocking Qui Gon's hair in the last Jedi.,,StarWars,99,,,https://www.reddit.com/r/StarWars/comments/76cvm7/rey_is_rocking_qui_gons_hair_in_the_last_jedi/,,Jayttic,76cvm7,/r/StarWars/comments/76cvm7/rey_is_rocking_qui_gons_hair_in_the_last_jedi/,https://i.redd.it/4yw82a6uhtrz.jpg,13,2017-10-14
Just watched The Force Awakens and Rogue One for the first time ever. Impressions.,"As you can guess by the title, I'm not really the biggest star wars fan, despite having seen the OT a few times (I mean who hasn't) and enjoying them. And with all the The Last Jedi hype over the last few days, I thought it was finally time to jump in and see what I've missed.

1) The Force Awakens

I can't imagine what the expectations for this was back at release, but my expectations were pretty much that I knew people liked it more than the prequels, other than that I was going in almost completely blind. I do have to admit, Han Solo's fate was already spoiled for me all the way back at release, as it seemed every comment section on the internet was unsafe from this spoiler, even ones completely unrelated to Star Wars, but it didn't ruin the experience for me. 

So, here goes nothing, I really enjoyed this movie.

One thing I didn't want was for them to rely too much on the older classic characters, and they didn't. I mean, they're there and their influence is felt, but the new characters are allowed to carry the movie. And like their original counterparts, there's a likability and charisma to them.

Finn - I want to be this guy's friend, he's bumbling and does some stupid stuff, but his bravery and charm cannot be denied. His loyalty to Rey is sweet and I hope she doesn't continue to friendzone him, lol.

Poe - Doesn't get much screen time unfortunately, but the short time he was there he made a good impact.

Han - Harrison didn't feel like he phoned it in and I'm glad. He was Han Solo, just as charming here as in the OT, his death was very well done as well imo.

Leia - Meh, weakest performance in the movie imo, didn't do anything for me. Maybe it's because Leia's so different from how she was in the OT, compared to Han who feels very similar. Hopefully Carrie's great in her final performance in The Last Jedi.

BB8 - I want one.

Rey - Pretty much the MVP of the movie, she probably made a slightly bigger impact on me in her first movie than Luke in A New Hope surprisingly, we'll see if it stays that way by the end of the trilogy. Strong and technically gifted, yet wide eyed and emotionally vulnerable, perfect kind of protagonist for young people that haven't experienced star wars before. I don't really know if there's anything that interesting they can do with her character tho, she's pretty much destined to follow the same arc as Luke did.

And lastly, Kylo Ren, if there's one character I'm very interested to see where they go with, it's this guy. At first I was like ""Okay he's a pretty good Vader knock off, he sounds cool, looks cool, has a cool lightsaber etc"" Well, turns out the reason I thought that was because he's a total fanboy lmao. He's a conflicted, insecure fanboy that throws temper-tantrums, and it's glorious. The fact that Rey already beat him however (despite being shot) makes me think he won't be the main bad guy in the end, because why would the give that moment away in the first movie of the trilogy otherwise?

My criticisms however are the fact that the movie plays it a little too safe on some of the plot elements. Hey, here's a Death Star, but this time it can destroy FIVE planets at once.
Hey, here's the empire, but they're even more OP now? I thought the Rebels won the last time?
Speaking of the Rebels, why are they still the underdogs? Did I miss something?
And like I said, Rey, although she's fantastic and a very charismatic hero, is pretty much just gonna be female Luke right?

But, despite the reuse of things from the OT, I can see why they did it after the mostly terrible reception of the prequels, and it didn't ruin the movie because I still very much enjoyed learning about these new characters and watching them interact, and at the end of the day, that's the most important part of storytelling to me, characterization. Still hope to see a couple of new twists in TLJ however.


2) Rogue One

So after thoroughly enjoying TFA, I had the Star wars itch back, so the next day I jumped into this. I knew nothing going into this one, no impressions, no trailers, no nothing except for the fact I know it was a New Hope prequel.

So remember when I just said in my TFA section that having characters I care about is the most important part of storytelling for me? Maybe that's why the first 2/3rds of this movie really didn't do much for me. So you have a plot where I pretty much know exactly how it's gonna end up, your only option at that point is to make me care through your characters, and I didn't. 

I can tell it's supposed to be a darker film and everything, but god everyone's so dull. When the robot is the one with the most personality, there's a problem. As things stand, Jyn the only one of the main group I can remember the name of, and that's just because she's the main character, because she was just kinda there aswell.

The movie really wanted me to care about her relationship with her dad, and I just couldn't, I feel like I needed an extra scene or two with her as a child. Like for example, one of my favorite games of all time The Last of Us has a very cute, funny scene with the main character and his daughter at the start, and I felt instantly attached to their relationship. That was missing here.

I also feel like there were too many characters. The first 30mins of the movie jumps all over the place trying to introduce so many characters at once, sometimes less is more and I definitely think that should be the case here.

So if the first 2/3rds of the movie were mostly sleep inducing for me, thank god they ramp up the action and big ass explosions in the final 3rd. Because despite me being a character first kinda guy, I do love me some big ass action scenes, and this definitely delivered on that front. Of course, it would of been better had I really cared for the safety and well being of our heroes, but it's still a very well done sequence nevertheless. If there's one thing you can't knock the film for, it's the way it looks.

The best part of the movie however was watching the one character I actually do care about, Darth fucking Vader absolutely crush those poor fuckers in the hallway, even the most basic star wars fan had to mark out for that one haha. On a less positive note, CGI Leia and Empire commander guy (I forgot his name) was a little jarring to say the least.

So yeah pretty meh movie overall in my opinion, if not for the final act it would've been Phantom Menace territory for me.",StarWars,81,,,https://www.reddit.com/r/StarWars/comments/76f4ui/just_watched_the_force_awakens_and_rogue_one_for/,,LukeParkes,76f4ui,/r/StarWars/comments/76f4ui/just_watched_the_force_awakens_and_rogue_one_for/,https://www.reddit.com/r/StarWars/comments/76f4ui/just_watched_the_force_awakens_and_rogue_one_for/,82,2017-10-14
The Nerd Crew: Episode 6 - The Last Jedi Trailer 2 Reaction! And Justice League Breakdown,,movies,79,,,https://www.reddit.com/r/movies/comments/76bxx6/the_nerd_crew_episode_6_the_last_jedi_trailer_2/,,AndISaidHey27,76bxx6,/r/movies/comments/76bxx6/the_nerd_crew_episode_6_the_last_jedi_trailer_2/,https://youtu.be/o3K44GQwxbA,29,2017-10-14
New dialogue from Luke and Rey in Star Wars: The Last Jedi | Novelty Candy Containers,,StarWarsLeaks,53,,,https://www.reddit.com/r/StarWarsLeaks/comments/76ae3p/new_dialogue_from_luke_and_rey_in_star_wars_the/,Merch,FearAngerHateSuffer,76ae3p,/r/StarWarsLeaks/comments/76ae3p/new_dialogue_from_luke_and_rey_in_star_wars_the/,https://youtu.be/OGrmshJsV5Y,31,2017-10-14
PSA: TV Spots are where the spoiler dial gets turned up to 11,"We just got our first TV spot, and we're likely to get many more in the next two months. As such, it's important to remember that TV spots are not made in the same way, or for the same audiences, as normal trailers.

The main trailers, especially the stellar trailers we've been getting for the recent Star Wars movies, are hyper-meticulous in the way they feed you the right amount of information to get hyped without giving the whole story away or making you feel like you've seen everything. TV Spots are much looser, by design. They're made for the casual fan, or even the non-fan, who may or may not want to see the movie in theaters but could be swayed if a TV spot shows them enough cool and interesting imagery. 

Here's what always happens, at least to me, when TV spots come out; I see too much. I see new scenes that I shouldn't have seen, I see extended moments from previously seen sequences that give away more than they should. If you're a film-literate Star Wars nerd, this is really dangerous, **because the more of these extra bits you see**, as small as they may seem individually, **the more you will be able to mentally patch together the jigsaw puzzle and before you know it, there's little discovery or surprise left in the final film**.

I'm not saying the TV spots are going to give away a massive plot twist or anything. I'm saying that if you want to truly *discover* The Last Jedi, it's in your best interest to stay away from the TV spots. Let the trailers tide you over. ",StarWars,35,,,https://www.reddit.com/r/StarWars/comments/76d8do/psa_tv_spots_are_where_the_spoiler_dial_gets/,Movies,hanburgundy,76d8do,/r/StarWars/comments/76d8do/psa_tv_spots_are_where_the_spoiler_dial_gets/,https://www.reddit.com/r/StarWars/comments/76d8do/psa_tv_spots_are_where_the_spoiler_dial_gets/,14,2017-10-14
The Nerd Crew: Episode 6 - The Last Jedi Trailer 2 Reaction!,,StarWars,33,,,https://www.reddit.com/r/StarWars/comments/76cfc1/the_nerd_crew_episode_6_the_last_jedi_trailer_2/,Movies,stormGEO,76cfc1,/r/StarWars/comments/76cfc1/the_nerd_crew_episode_6_the_last_jedi_trailer_2/,https://www.youtube.com/watch?v=o3K44GQwxbA,9,2017-10-14
RedLetterMedia - The Last Jedi Trailer 2 Reaction,,movies,27,,,https://www.reddit.com/r/movies/comments/76ctck/redlettermedia_the_last_jedi_trailer_2_reaction/,,TheGanjaLord,76ctck,/r/movies/comments/76ctck/redlettermedia_the_last_jedi_trailer_2_reaction/,https://www.youtube.com/watch?v=o3K44GQwxbA,19,2017-10-14
