title,selftext,subreddit,score,upvote_ratio,total_awards_received,full_link,link_flair_text,author,id,permalink,url,num_comments,date
Star Wars: The Last Jedi Director Talks About Why You Should Maybe Skip The New Trailer (Drops Monday night U.S time),,movies,3440,,,https://www.reddit.com/r/movies/comments/757t5a/star_wars_the_last_jedi_director_talks_about_why/,,reap7,757t5a,/r/movies/comments/757t5a/star_wars_the_last_jedi_director_talks_about_why/,https://www.gamespot.com/articles/star-wars-the-last-jedi-director-talks-about-why-y/1100-6453878/,1000,2017-10-09
The Last Jedi Tickets Presale Megathread,"**TICKETS ARE LIVE!! BUY!! BUY!! BUY!!**

It’s almost that time fellow fans!
This is the official ticket MegaThread that the mods have been awesome enough to help put in place.
Throughout the evening Ill do my best to post any new and relevant information or summaries of updates provided by everyone else pertaining to the ticket release here, including:

- Actual time the tickets go online for the masses
- Tracking what apps/services are up, which ones are slow, and which ones are just plain dead
- Areas sold out and % of tickets left overall

Etc etc....

I cant do it alone, so please don’t hesitate to post your experiences and tips that may help others!
Good luck to everyone!

BE AWARE THAT IF YOU WANT AN OPENING SHOW THERE ARE MULTIPLE OPTIONS! Check your theater for all of these listing types to make sure you're getting the opening/premiere showing you want.

There's currently the standard THE LAST JEDI listing, the double header (episode 7 and 8), marathons of all films, then the Last Jedi Fan Event.

**WHAT WE KNOW NOW:**

Tickets go on sale after the trailer premieres. There is no set time for this but the game will start at approximately 815pm EST.
Be aware that last year, tickets inexplicably went online a full hour early. I personally had mine purchased at 730pm EST. So be vigilant.

Also as requested by the mods, here is a link to the Haircut of the Month club!

https://www.reddit.com/r/StarWars/comments/74xpj9/worst_haircut_of_the_month/

**Update curtesy of droidroid**

UK People
My info applies to Cineworld only. Officially we're stating that tickets go on sale at 7am but we were instructed to put them up for sale from 23:30 tonight. Expect to see tickets for some sites appearing soon online. 

**UPDATE 2**
Warning!! Director of TLJ warns there are minor spoilers in the newest trailer playing during the game - I know this isn't the trailer thread but fair warning.

https://moviepilot.com/p/rian-johnson-warns-fans-not-to-watch-the-last-jedi-trailer/4385207

**UPDATE 3** *Fandango tickets are ""live"" and allow you to select seats but don't allow you to check out!*

**UPDATE 4** *Fandango and Regal Websites/Apps are holding strong! We haven't given them the hug of death this time it seems.  Both sites are still loading for me.  No word on areas sold out yet.*

**UPDATE 5** AMC THEATER USERS! Use the AMC service! Fandango doesn't appear to be properly servicing that theater chain!!

**UPDATES 10 Oct**

Word on fandango fan shop? Store appears down.  

Orlando still has marathon tickets available on the 13th - https://mobile.fandango.com/amc-dine-in-disney-springstm-24-AABNU/theater-page?rds=2&amp;date=12%2F13%2F2017

*UNCONFIRMED* Use code **applejedi** for $5 off Fandango when using apple pay.

**Here are some other special offers and promotions going on for Star Wars: The Last Jedi that we know about so far.**

http://www.starwars.com/news/star-wars-the-last-jedi-ticket-offers-and-giveaways
",StarWars,616,,,https://www.reddit.com/r/StarWars/comments/75cwai/the_last_jedi_tickets_presale_megathread/,Movies,Admiral_Tasty_Puff,75cwai,/r/StarWars/comments/75cwai/the_last_jedi_tickets_presale_megathread/,https://www.reddit.com/r/StarWars/comments/75cwai/the_last_jedi_tickets_presale_megathread/,1820,2017-10-09
Star Wars: The Last Jedi - Official Trailer #2 (2017),,4chan,253,,,https://www.reddit.com/r/4chan/comments/759aoq/star_wars_the_last_jedi_official_trailer_2_2017/,,BasicallyADoctor,759aoq,/r/4chan/comments/759aoq/star_wars_the_last_jedi_official_trailer_2_2017/,https://streamable.com/hjssk,30,2017-10-09
I made this for The Last Jedi - What do you want to see in the new trailer? Hoping for more AhchTo shots!,,StarWars,119,,,https://www.reddit.com/r/StarWars/comments/75aima/i_made_this_for_the_last_jedi_what_do_you_want_to/,Fan Creations,kaymackgee,75aima,/r/StarWars/comments/75aima/i_made_this_for_the_last_jedi_what_do_you_want_to/,https://i.redd.it/8jeemk9y6uqz.png,12,2017-10-09
Coming Soon: Pop! Deluxe: Star Wars: The Last Jedi - Kylo in TIE Fighter,,funkopop,90,,,https://www.reddit.com/r/funkopop/comments/75a12x/coming_soon_pop_deluxe_star_wars_the_last_jedi/,News,RegExr,75a12x,/r/funkopop/comments/75a12x/coming_soon_pop_deluxe_star_wars_the_last_jedi/,https://funko.com/blogs/news/coming-soon-pop-deluxe-star-wars-the-last-jedi-kylo-in-tie-fighter,65,2017-10-09
"The Last Jedi: 155 minutes, PG-13",,starwarsspeculation,66,,,https://www.reddit.com/r/starwarsspeculation/comments/759q1z/the_last_jedi_155_minutes_pg13/,,ludwigritcher752,759q1z,/r/starwarsspeculation/comments/759q1z/the_last_jedi_155_minutes_pg13/,https://www.regmovies.com/movies/star-wars-the-last-jedi-opening-night-fan-event/B00523608104,30,2017-10-09
Star Wars The Last Jedi trailer to debut tonight during the Vikings vs Bears game.,,nfl,54,,,https://www.reddit.com/r/nfl/comments/7599e2/star_wars_the_last_jedi_trailer_to_debut_tonight/,,cmath89,7599e2,/r/nfl/comments/7599e2/star_wars_the_last_jedi_trailer_to_debut_tonight/,https://mobile.twitter.com/GMA/status/916981957438984192/video/1,59,2017-10-09
"The Last Jedi director on the upcoming trailer; ""If you want to come in clean, absolutely avoid it."" Sounds like there's possibly a big reveal in the upcoming trailer...",,movies,47,,,https://www.reddit.com/r/movies/comments/757wms/the_last_jedi_director_on_the_upcoming_trailer_if/,,jb_in_jpn,757wms,/r/movies/comments/757wms/the_last_jedi_director_on_the_upcoming_trailer_if/,https://twitter.com/rianjohnson/status/917049537843183618,27,2017-10-09
The Last Jedi IMAX Tickets Instructions,,StarWars,44,,,https://www.reddit.com/r/StarWars/comments/759nkv/the_last_jedi_imax_tickets_instructions/,Movies,captainjjb84,759nkv,/r/StarWars/comments/759nkv/the_last_jedi_imax_tickets_instructions/,https://www.imax.com/news/The-Last-Jedi-IMAX-Tickets,34,2017-10-09
Is this a safe place for a nervous EU fan to confide in others?,"Hello friends,

I am nervous about Eposide VIII. I don't want to rant, or complain, I just want some other old score Star Wars fans to talk to. Some people who understood what it was like when Star Wars stopped being in the pop culture and lived on the page, a few windows 98 games, and in our imagination.
  I am nervous for two reasons. The ethics of Star Wars, and my boyhood hero and idol Luke Skywalker. Since the closing moments of VII I have waited to see Jedi Master Luke in his full power. Standing up for harmony, tranquility, and the Jedi and returning balance and justice to the universe. I followed his exploits in Heir to the Empire, Shadows of the Empire, even all the way up to Star Wars Legacy when he was a force ghost.  I loved all these things, but of course, i yearned to see him on the screen. The lv 20 mythical leader Luke - the one who brought balance to the force after all. 
  What I fear - is Star wars will become postmodernist. The Jedi will be treated like a dogma, instead of a metaphysical order. Luke will be jaded and cynical, and things will turn a faded shade of grey. Will they even give him a death worthy of his nature - or will it be a simple cliche ""if you strike me down"" moment? 
  This hurts my boyhood visions, but it also makes me sad for Lucas. He made Star Wars to combat the cynical 70's films, and show that the old hero myth could be reforged into something bright and inspiring. And he sure fucking proved his point. 

I just don't want that to die. In Star Wars legacy it was hard for Cade to see the light. It was hard for him to understand that the dark side was malicious and that it really mattered if you listened to the Jedi Code or not. It was hard for him to see past the darkness, cynicism, drugs, hate, and death..but he did. And that is what Star Wars is about in the end - the light shining in the big blackness of Space.
.....I just want to see Luke holding the torch one last time...even if he is only there to hand it to Rey.

Thanks for listening friends. ",StarWarsEU,38,,,https://www.reddit.com/r/StarWarsEU/comments/75cs3i/is_this_a_safe_place_for_a_nervous_eu_fan_to/,,Radiozero,75cs3i,/r/StarWarsEU/comments/75cs3i/is_this_a_safe_place_for_a_nervous_eu_fan_to/,https://www.reddit.com/r/StarWarsEU/comments/75cs3i/is_this_a_safe_place_for_a_nervous_eu_fan_to/,28,2017-10-09
"ARTICLE: ‘Justice League’ Trailer, ‘Star Wars: The Last Jedi’ Anticipation Dominate Social Media Chatter",,DC_Cinematic,25,,,https://www.reddit.com/r/DC_Cinematic/comments/75aprs/article_justice_league_trailer_star_wars_the_last/,DISCUSSION,bewarey,75aprs,/r/DC_Cinematic/comments/75aprs/article_justice_league_trailer_star_wars_the_last/,http://variety.com/2017/film/news/justice-league-star-wars-the-last-jedi-social-media-1202584232/,4,2017-10-09
Available Now: Costco Exclusive The Last Jedi Pop! 4-Packs!,,funkopop,22,,,https://www.reddit.com/r/funkopop/comments/75bb9c/available_now_costco_exclusive_the_last_jedi_pop/,News,RegExr,75bb9c,/r/funkopop/comments/75bb9c/available_now_costco_exclusive_the_last_jedi_pop/,https://funko.com/blogs/news/coming-soon-costco-exclusive-the-last-jedi-pop-4-packs,21,2017-10-09
Every Movie Theater Showing 'The Last Jedi' in IMAX 70mm,,StarWars,12,,,https://www.reddit.com/r/StarWars/comments/75bduo/every_movie_theater_showing_the_last_jedi_in_imax/,Movies,Evan2895,75bduo,/r/StarWars/comments/75bduo/every_movie_theater_showing_the_last_jedi_in_imax/,http://www.indiewire.com/2017/10/star-wars-the-last-jedi-tickets-imax-70mm-theater-locations-1201885373/,2,2017-10-09
Hero skins/outfits that would be great to see at launch and post launch.,"I love the fact that we can change the skins/outfits of the heroes in Battlefront 2! These are skins I would love to see at launch and post launch for already known heroes and possible future heroes (DLC):

Known Heroes:

Luke Skywalker: Farm boy outfit, Rebel pilot outfit, Bespin outfit, both Return of the Jedi black outfits, Hoth outfit, Endor outfit (cape), Ep. IV yellow jacket, The Last Jedi outfit (old Luke), and the Dagobah outfit.

Han Solo: Endor outfit (coat), Ep. VI Tatooine outfit (Sarlacc pit), Hoth outfit, and Old Han (The Force Awakens).

Leia: Ep. IV outfit (hair buns), Bespin outfit, Endor outfit, Hoth outfit, Boushh outfit, and the outfit she's wearing when the Rebellion are discussing the Endor mission on Ep. VI.

Chewbacca: Bag with C3-PO on his back, and old Chewie.

Lando Calrissian: Ep. VI outfit (General uniform)

Boba Fett: Prototype Armor (white armor)

Emperor Palpatine: Ep. III outfit (red)

Darth Maul: With robe, and robotic legs version.

Finn: First Order trooper outfit (No helmet)

Captain Phasma: No helmet

Possible Future Heroes (DLC):

Obi Wan Kenobi: Ep. I, II, III (with and without robe- maybe just for the Ep. III version).

Anakin Skywalker: Ep. II, III (with and without robe- maybe just for the Ep. III version).

Jango Fett: No helmet outfit, and with cape outfit.

General Grievous: with cape

Mace Windu: with robe

Qui Gon Jinn: with robe

Asajj Ventress: with robe

Plo Koon: with robe

Kit Fisto: with robe, and shirtless.

Padme Amidala: Genosis outfit (with and without cape), and Mustafar outfit (Ep. III).

Zam Wesell: masked and unmasked

Jyn Erso: Jedha outfit, and imperial outfit.

Orson Krennic: with hat

Saw Gerrera: younger version

(btw, I know some of the skins mentioned here were found on leaks XD)

So, what hero skins would you guys like to see at launch and post launch for known characters and possible future characters? Did I miss any possible skins/outfits for the previously mentioned characters? Tell me which ones. May the Force be with You. Always.
 ",StarWarsBattlefront,9,,,https://www.reddit.com/r/StarWarsBattlefront/comments/756qt9/hero_skinsoutfits_that_would_be_great_to_see_at/,,NinjaShadow111,756qt9,/r/StarWarsBattlefront/comments/756qt9/hero_skinsoutfits_that_would_be_great_to_see_at/,https://www.reddit.com/r/StarWarsBattlefront/comments/756qt9/hero_skinsoutfits_that_would_be_great_to_see_at/,6,2017-10-09
"How bad can a despair be, anyway?","So, ive been GMing for a group for about 10 months now, and we just had a very interesting couple of sessions that were kicked off entirely from just one very, very bad roll.  I figured id tell people about our interesting story, and see if anyone else had some to share as well!

For background setting - takes place in 2000BBY, 3 characters are members of the jedi order, one is a loner survivalist, one is a bounty hunter and the last is a th0t (former twilek slave dancer who is force sensitive).  The sith have risen up, made an alliance with several Hutt cartels, and have launched a multi-front invasion of the Republic.

Our Twi'lek, Shaida, had her sister kidnapped, and our group finally had the means and story opportunity to track down the sister and rescue her.  One character was using seek, and the NPC astromech was making astrogation checks.  Since this was a complicated way of trying to narrow down where this kid was in the whole galaxy, and i was trying to wrap several weeks of hyperspace jumps up into one roll, i decided to make it just one fairly difficult roll.  2 yellow, 2 green vs 3 red 2 purple.  Poor little astromech rolled 2 despairs, but -succeeded- on the roll.  Note that this will be a common situation we find ourselves in.

So, they passed but something awful happens.  Well, i decided that now would be a fantastic time to drop some PLOT in, and our group finds themselves in a bizarre system made of one star, two black holes, and their hyperdrive system completely blows out. Nestled right in the middle of all these competing gravity wells is a single dwarf planet, barren of all life, covered in a fine dust, but somehow still managed to hold an atmosphere.  Cue extremely difficult piloting check for our bounty hunter to fly their medium freighter in.  5 yellow and 1 green to 4 red 1 purple 1 black (handling).  Bounty Hunter gets a despair, but passes the roll.  They manage to make it into the planets atmosphere but burn out their thrusters fighting the gravity from the star and two black holes.  Freighter is flying in, unpowered, everyone is thinking its about to be a team party kill.  Loner survivalist (with 4 force rating), uses Move with pretty much every point, light side and dark side, going into silhouette increase.  Manages to stop the ship meters from a deadly impact.  Tensions are high but the party is ecstatic.

Party starts investigating bizarre planet.  Find massive, starship sized trap door in the planets crust.  They descend into the planet to find it is a Rakatan factory, and the Guardian jedi character decides to plug his computer brain into said factory.  Factory is being controlled by Rakatan AI/Holocron personality, and was used to build a large, planet killing device that the Sith had stolen several years previously.Several incredibly difficult Discpline checks are made between the Guardian and Rakatan AI, of which he passes ALL, but gets a despair on his last check when he unplugs.  We decided the most logical course of action was a fragment of the AI's personality was now permanently residing inside the Guardian, and he would gain 1 conflict per game just from its corrupting influence!  The story/humor opportunities from this despair just keep on giving.

They decide to destroy the planet, after forcing the AI (out of sheer personal preservation) to build them a new hyperdrive for their freighter.  They plant proton torpedoes inside the AI matrix and inside power plants, get in their freighter, and one last, really awful roll for the bounty hunter to make to fly them out of there.  Three despairs, but he passes the roll.  As the planet is exploding around them, they collide with a mountain of rock and take 5 damage per despair to the ship but manage to make it out of the atmosphere, and on to the rest of the galaxy where they will more than likely continue hunting Sith in a failing-up sort of way!

Anyone else got good stories that came out of Despairs?",swrpg,8,,,https://www.reddit.com/r/swrpg/comments/75c1px/how_bad_can_a_despair_be_anyway/,,EgoCognis,75c1px,/r/swrpg/comments/75c1px/how_bad_can_a_despair_be_anyway/,https://www.reddit.com/r/swrpg/comments/75c1px/how_bad_can_a_despair_be_anyway/,7,2017-10-09
Sound off: Will you be watching or avoiding the new trailer for Thr Last Jedi thats being released tonight?,[removed],StarWars,6,,,https://www.reddit.com/r/StarWars/comments/75cago/sound_off_will_you_be_watching_or_avoiding_the/,,jasteinerman,75cago,/r/StarWars/comments/75cago/sound_off_will_you_be_watching_or_avoiding_the/,https://www.reddit.com/r/StarWars/comments/75cago/sound_off_will_you_be_watching_or_avoiding_the/,9,2017-10-09
Are we allowed to take time off in December?,I was curious because I going to buy tickets for The Last Jedi on the 14th of December but wasn't sure since it's around when Christmas is. ,Target,6,,,https://www.reddit.com/r/Target/comments/75c00b/are_we_allowed_to_take_time_off_in_december/,,bluetooth362,75c00b,/r/Target/comments/75c00b/are_we_allowed_to_take_time_off_in_december/,https://www.reddit.com/r/Target/comments/75c00b/are_we_allowed_to_take_time_off_in_december/,13,2017-10-09
Predicting the 2017 Studio Total Gross,"**7th: Paramount (Viacom)** with $520M-$550M and 5.5% of the market share

-So far Paramount made $407 million with 5% of the market share and their top 5 films are: Monster Trucks ($33 million), Ghost in the Shell ($41 million), xXx: Return of Xandar Cage ($45 million), Baywatch ($58 million), and their supposed billion dollar franchise movie that blew up in their face and under-performed, Transformers: The Last Knight ($130 million)

-Their upcoming films are Suburbicon, Daddy's Home 2, and Downsizing

-Suburbicon and Downsizing should each make at least $20 million while Daddy's Home could make at least $70 million. 

-2017 is Paramount's worst year since 2004 (Paramount made $628 million in 2004) and their worst year for the last decade (their lowest besides 2017 was in 2015 with $675 million). Comparing 2017 to 2016 for Paramount, Paramount did a lot worse this year than last year since Paramount had Jack Reacher: Never Go Back ($59 million), 10 Cloverfield Lane ($72 million), TMNT 2 ($82 million), Arrival ($92 million), and Star Trek Beyond ($159 million) last year which performed better than this year's top 5.

**6th: Lionsgate** with $850M-$880M and 8.7% of the market share

-So far Lionsgate made $650 million with 8% of the market share and their top 5 films are: The Shack ($57 million), The Hitman's Bodyguard ($75 million), Power Rangers ($85 million), John Wick: Chapter 2 ($92 million), and La La Land ($120 million)

-Their upcoming films are My Little Pony: The Movie, Tyler Perry's Boo 2! A Madea Halloween, Jigsaw, Last Flag Flying, and Wonder

-Tyler Perry's Boo 2! A Madea Halloween could make about $80 million. Jigsaw and Wonder could each make about $40 million. Last Flag Flying could make about $20 million. My Little Pony the Movie could make about $20 million.

-2017 could be Lionsgate's 3rd best year since their rise in popularity in 2012 as a film studio with the release of the Hunger Games and Twilight Breaking Dawn Part 2. While the results won't be as good as their results from 2012 and 2013, it should be better than how they were faring from 2014-2016. Comparing 2017 to 2016 for Lionsgate, Lionsgate did a lot better than last year since Lionsgate had Now You See Me 2 ($65 million), Allegiant ($66 million), Hacksaw Ridge ($67 million), Boo! A Madea Halloween ($73 million), and La La Land ($151 million) last year which performed worse than this year's top 5.

**5th: Sony/Columbia** with $980M-about $1B and 10.1% of the market share

-So far Sony made $795 million with 10% of the market share and their top 5 films are: Smurfs: The Lost Village ($45 million), The Dark Tower ($51 million), The Emoji Movie ($85 million), Baby Driver ($108 million), and their billion dollar franchise movie, Spider-Man Homecoming ($333 million)

-Their upcoming films are Only the Brave, Roman J. Israel, Esq., The Star, All the Money in the World, and Jumanji: Welcome to the Jungle

-Only the Brave, Roman J. Israel, Esq., and All the Money in the World could each make at least $20 million. The Star could make at least $60 million. Jumanji: Welcome to the Jungle could make at least $100 million. 

-2017 could be Sony's first year since 2014 (Sony made $1.3 billion in 2014) where they could make at least $1 billion (or barely cross it in this case). Comparing 2017 to 2016 for Sony, Sony did a lot better than last year since Sony had The Magnificent Seven ($93 million), Sausage Party ($98 million), Passengers ($100 million), The Angry Birds Movie ($108 million), and Ghostbusters ($128 million) last year which performed worse than this year's top 5 (mostly because of Spider-Man Homecoming, Baby Driver, and the Emoji Movie).

**4th: 20th Century Fox** with $1.2B and 12% of the market share

-So far Fox made $1.1 billion with 13% of the market share and their top 6 (since 5 and 6 are very close to each other) films are: Captain Underpants ($73.9 million), Alien: Covenant ($74.3 million), War for the Planet of the Apes ($146 million), Hidden Figures ($167 million), Boss Baby ($175 million), and Logan ($226 million)

-Their upcoming films are Murder on the Orient Express, Ferdinand, The Post, and the Greatest Showman

-Murder on the Orient Express and Ferdinand could each make about $40 million. The Greatest Showman and the Post could each make about $30 million

-Comparing 2017 to 2016 for Fox, they didn't do as well this year as they did last year since Fox had Kung Fu Panda 3 ($144 million), Trolls ($154 million), X-Men: Apocalypse ($155 million), Hidden Figures ($169 million), and of course, Deadpool ($363 milllion) last year which performed better than this year's top 5 (mostly because of Deadpool). 

**3rd: Universal (NBCUniversal)** with $1.6B and 16% of the market share

-So far Universal made $1.36 billion with 17% of the market share and their top 5 films are: Sing ($117 million), Split ($138 million), Get Out ($175 million), and their two biggest franchises with their own movies, The Fate of the Furious ($226 million), and Despicable Me 3 ($262 million).

-Their upcoming films are Happy Death Day, The Snowman, Thank You for Your Service, and Pitch Perfect 3

-Thank You for Your Service could make about $20 million. Happy Death Day and the Snowman could each make about $30 million. Pitch Perfect 3 could make about $200 million

-Comparing 2017 to 2016 for Universal, Universal did better this year than last year since Universal had The Purge: Election Year ($79 million), Ride Along 2 ($91 million), Jason Bourne ($162 million), Sing ($270 million), and The Secret Life of Pets ($368 million) last year which makes it possible that 2017 Universal can surpass 2016.

**2nd: Warner Bros (Time Warner) (currently in 1st place)** with $2.1B and 20.9% of the market share

-So far Warner Bros made $1.6 billion with 20% of the market share and their top 5 films are: Kong: Skull Island ($168 million), The LEGO Batman Movie ($176 million), Dunkirk ($187 million), It ($291 million), and Wonder Woman ($412 million).

-Their upcoming films are Blade Runner 2049, Geostorm, Justice League, and Father Figures.

-Father Figures could make about $30 million. Geostorm could make about $40 million. Blade Runner 2049 could make about $80 million. Justice League could make about $350 million.

-Comparing 2017 to 2016, Warner Bros did better this year than last year since Warner Bros. had The Legend of Tarzan ($126.6 million), Central Intelligence ($127.4 milion), Fantastic Beasts and Where to Find Them ($234 million), Suicide Squad ($325 million), and Batman v Superman ($330 million) last year which didn't perform as well as this year's top 5.

**1st: Disney (currently in 2nd place)** with $2.7B and $25.9% of the market share

-So far Disney made $1.4 billion with 17% of the market share and their top 5 films are: Rogue One ($124 million), Cars 3 ($152 million), Pirates of the Carribean: Dead Men Tell No Tales ($173 million), Guardians of the Galaxy Vol. 2 ($390 million), and Beauty and the Beast ($504 million).

-Their upcoming films are Thor: Ragnarok, Coco, and Star Wars: The Last Jedi.

-Coco could make about $130 million. Thor:Ragnarok could make about $320 million. Star Wars: The Last Jedi could make about $850 million.

-Comparing 2017 to 2016 for Disney, Disney did slightly worse this year than last year (Disney made $3B last year) since Disney had Zootopia ($341 million), The Jungle Book ($364 million), Captain America: Civil War ($408 million), Finding Dory ($486 million), and Rogue One ($532 million) last year which performed better than this year's top 5 (though none of them can beat Star Wars: The Force Awakens with $937 million).

EDIT: Forgot about Blade Runner 2049 and My Little Pony the Movie.







",boxoffice,6,,,https://www.reddit.com/r/boxoffice/comments/755myd/predicting_the_2017_studio_total_gross/,DISCUSSION,valkyria_knight881,755myd,/r/boxoffice/comments/755myd/predicting_the_2017_studio_total_gross/,https://www.reddit.com/r/boxoffice/comments/755myd/predicting_the_2017_studio_total_gross/,17,2017-10-09
